W3181_1040,,22,,leucyl-tRNA synthetase LeuS,leuS,,tRNA charging,,Expected Essential,Leucyl-tRNA synthetase (EC 6.1.1.4),A hypothetical protein that co-occurs with Leucyl-tRNA synthetase; <br>CBSS-208964.1.peg.3988; <br>tRNA aminoacylation Leu,,,,ATP,,,,6.1.1.4,core,1,cyt,Shw00950W3181_1041,,22,,protein of unknown function DUF1451,,,,,Dispensable,FIG002095: hypothetical protein,A hypothetical protein that co-occurs with Leucyl-tRNA synthetase,,,,,,,,,core,1,cyt,Shw00951W3181_1042,,9,,methyltransferase family 16,,,,,,SAM-dependent methyltransferases,,,,,,,,,,,1,cyt,Shw06518W3181_1044^,,13,,PilD processed protein,,,surface structure,,Dispensable,methylation site containing protein,,,,,,,,,,,1,IM 1 TM | surface structure,Shw00952W3181_1045,,22,,apolipoprotein N-acyltransferase Lnt,lnt,cutE,Phosphate metabolism,,Expected Essential,Apolipoprotein N-acyltransferase (EC 2.3.1.-) / Copper homeostasis protein CutE,Copper homeostasis: copper tolerance; <br>Lipoprotein Biosynthesis; <br>Phosphate metabolism; <br>tRNA-methylthiotransferase containing cluster; <br>tRNA-methylthiotransferase containing cluster,,,,,,,,2.3.1.-,core,1,IM 7 TM,Shw00953W3181_1046,,22,,magnesium and cobalt efflux protein CorC,corC,ybeX,Transport | export - Mg/Co,,Unknown,Magnesium and cobalt efflux protein CorC,CBSS-56780.10.peg.1536; <br>Copper homeostasis: copper tolerance; <br>Phosphate metabolism; <br>tRNA-methylthiotransferase containing cluster,,,,,,,9.A.40.1,,core,1,cyt-IM assoc,Shw00954W3181_1047,,22,,rRNA maturation factor YbeY,ybeY,,rRNA modification,,Expected Essential,FIG000233: metal-dependent hydrolase,CBSS-56780.10.peg.1536; <br>Phosphate metabolism; <br>tRNA-methylthiotransferase containing cluster,,,,,metal,,,,core,1,cyt,Shw00955W3181_1048,,22,,putative ATP-binding protein YbeZ,ybeZ,,rRNA modification,,Dispensable,Phosphate starvation-inducible ATPase PhoH with RNA binding motif,CBSS-56780.10.peg.1536; <br>Phosphate metabolism; <br>Putative hemin transporter; <br>tRNA-methylthiotransferase containing cluster,,,,ATP,,,,,core,1,cyt,Shw00956W3181_1049,,22,,tRNA-N(6)-(isopentenyl)adenosine-37 thiotransferase enzyme MiaB,miaB,,tRNA modification,,Dispensable,tRNA-i(6)A37 methylthiotransferase,Methylthiotransferases; <br>Ribosomal protein S12p Asp methylthiotransferase; <br>tRNA-methylthiotransferase containing cluster; <br>tRNA processing,,,,SAM,4Fe-4S,,,,core,1,cyt,Shw00957W3181_1050,,22,,2-octaprenyl-3-methyl-6-methoxy-14-benzoquinone hydroxylase UbiF,ubiF,,,,Unknown,Putative 2-octaprenyl-3-methyl-6-methoxy-14-benzoquinol hydroxylase,,,,,FAD,,,,1.14.13.-,core,1,cyt,Shw00959W3181_1051,,22,,peptidyl-tRNA hydrolase Pth,pth,,Translation termination factors,,Expected Essential,Peptidyl-tRNA hydrolase (EC 3.1.1.29),Cell division-ribosomal stress proteins cluster; <br>Sporulation-associated proteins with broader functions; <br>Translation termination factors bacterial,,,,,,,,3.1.1.29,core,1,cyt,Shw00960W3181_1052,,22,21570909   21527254,GTP-binding and nucleic acid-binding protein YchF,ychF,yyaF engD,Universal GTPases,,Dispensable Unclear In Ecoli,GTP-binding and nucleic acid-binding protein YchF,Universal GTPases,,,,GTP,,,,3.6.5.-,core,1,cyt,Shw00961W3181_1053,,11,,hypothetical protein,,,,,Unknown,hypothetical protein,,,,,,,,,,,1,IM 1 TM,Shw00962W3181_1054,,13,,inner membrane protein with PepSY TM helix,,,Iron homeostasis,Fur,Unknown,putative membrane protein,,,,,,,,,,,1,IM 3 TM,Shw00963W3181_1055,,13,,putative periplasmic protein of unknown function DUF2271,,,Iron homeostasis,Fur,Dispensable,putative exported protein,,,,,,,,,,,1,peri,Shw00964W3181_1056,,13,,putative periplasmic CbiK superfamily protein,,,Iron homeostasis,Fur,Dispensable,putative exported protein,,,,,,,,3.A.1,,,1,peri,Shw00965W3181_1057,,22,,transcription elongation factor GreA,greA,,Transcription factors,,Dispensable,Transcription elongation factor GreA,Transcription factors bacterial,,,,,,,,,core,1,cyt,Shw00966W3181_1058,,19,,conserved hypothetical extracytoplasmic protein,,,low temperature,,Unknown,hypothetical protein,,,,,,,,,,,1,peri,Shw00967W3181_1059,,19,,preprotein translocase subunit SecD,secD,,protein export - GSP,,Dispensable,Protein-export membrane protein SecD (TC 3.A.5.1.1),CBSS-211586.1.peg.2832,,,,,,,2.A.6.4,,,1,IM 6 TM,Shw00968W3181_1060,,19,,preprotein translocase subunit SecF,secF,,protein export - GSP,,Dispensable,Protein-export membrane protein SecF (TC 3.A.5.1.1),CBSS-211586.1.peg.2832,,,,,,,2.A.6.4,,,1,IM 6 TM,Shw00969W3181_1061,,22,,putative RNA-binding protein YhbY,yhbY,,,,Dispensable,FIG004454: RNA binding protein,,,,,,,,,,core,1,cyt,Shw00970W3181_1062,,22,,23S rRNA (uridine2552-2'-O)-methyltransferase RrmJ,rrmJ,rlmE ftsJ,rRNA modification - 23S,,Dispensable,Cell division protein FtsJ / Ribosomal RNA large subunit methyltransferase J (EC 2.1.1.-),Bacterial Cell Division,,,,,,,,2.1.1.166,core,1,cyt,Shw00971W3181_1063,,22,,ATP-dependent zinc metalloprotease FtsH,ftsH,,Membrane-bound proteolytic system,,Expected Essential,Cell division protein FtsH (EC 3.4.24.-),Bacterial Cell Division; <br>Cell division-ribosomal stress proteins cluster,,,M41,ATP,Zn,,,3.4.24.-,core,1,IM 2 TM,Shw00972W3181_1064,,22,,dihydropteroate synthase FolP,folP,,Folate Biosynthesis,,New Essential,Dihydropteroate synthase (EC 2.5.1.15),Folate Biosynthesis,,,,B12,,,,2.5.1.15,core,1,cyt,Shw00973W3181_1065,,22,,phosphoglucosamine mutase GlmM,glmM,,,,Expected Essential,Phosphoglucosamine mutase (EC 5.4.2.10),Sialic Acid Metabolism; <br>UDP-N-acetylmuramate from Fructose-6-phosphate Biosynthesis,,,,,,,,5.4.2.10,core,1,cyt,Shw06558bW3181_1066,,22,,triosephosphate isomeraseTpiA,tpiA,,Glycolysis and Gluconeogenesis,,Unknown,Triosephosphate isomerase (EC 5.3.1.1),CBSS-331978.3.peg.2915; <br>Glycolysis and Gluconeogenesis; <br>Glycolysis and Gluconeogenesis including Archaeal enzymes,,,,,,,,5.3.1.1,core,1,cyt,Shw00975W3181_1067,,22,,preprotein translocase subunit SecG,secG,,protein export - GSP,,Unknown,Preprotein translocase subunit SecG (TC 3.A.5.1.1),CBSS-331978.3.peg.2915; <br>Murein hydrolase regulation and cell death,,,,,,,3.A.5.1,,core,1,IM 2 TM,Shw00976W3181_1068,,22,,ribosome maturation factor RimP,rimP,,Ribosome biogenesis - SSU,,Expected Essential,COG0779: clustered with transcription termination protein NusA,NusA-TFII Cluster; <br>Transcription factors bacterial,,,,,,,,,core,1,cyt,Shw00977W3181_1069,,22,,N utilization substance protein A NusA,nusA,,Transcription factors,,Expected Essential,Transcription termination protein NusA,NusA-TFII Cluster; <br>Transcription factors bacterial,,,,,,RNA,,,core,1,cyt,Shw00978W3181_1070,,22,,translation initiation factor IF-2 InfB,infB,,Translation initiation factors,,Expected Essential,Translation initiation factor 2,CBSS-138119.3.peg.2719; <br>NusA-TFII Cluster; <br>Translation initiation factors bacterial; <br>Universal GTPases,,,,GTP,,,,3.6.5.3,core,1,cyt,Shw00979W3181_1071,,22,,ribosome-binding factor A RbfA,rbfA,,Translation initiation factors,,Dispensable,Ribosome-binding factor A,CBSS-138119.3.peg.2719; <br>NusA-TFII Cluster; <br>Translation initiation factors bacterial,,,,,,,,,core,1,cyt,Shw00980W3181_1072,,22,,tRNA pseudouridine55 synthase TruB,truB,yhbA,tRNA modification,,,tRNA pseudouridine synthase B (EC 4.2.1.70) ## tRNA Psi55,CBSS-138119.3.peg.2719; <br>tRNA processing,,,,,,,,5.4.99.25,core,1,cyt,Shw00981W3181_1073,,22,,30S ribosomal protein S15 RpsO,rpsO,,Ribosome SSU,,Expected Essential,SSU ribosomal protein S15p (S13e),Ribosome SSU bacterial,,,,,,,,,core,1,cyt,Shw00982W3181_1074,,22,,bifunctional diguanylate cyclase/phosphodiesterase,,,Sensory transduction,,Unknown,GGDEF domain protein,,,,,,,,,2.7.7.65,core,1,IM 2 TM,Shw00983W3181_1075,,22,,polyribonucleotide nucleotidyltransferase PnpA,pnpA,,RNA degradosome,,Expected Essential,Polyribonucleotide nucleotidyltransferase (EC 2.7.7.8),Bacterial RNA-metabolizing Zn-dependent hydrolases; <br>Polyadenylation bacterial,,,,,phosphate,,,2.7.7.8,core,1,cyt,Shw00984W3181_1076,,22,,globular tetratricopeptide repeat containing lipoprotein NlpI,nlpI,,,,Dispensable,Lipoprotein nlpI precursor,,,,,,,,,,core,1,LP-OM,Shw00985W3181_1076.1 W3181_4108,,1,,recombination directionality factor RdfM,rdfM,jef,DNA mobilization,,,,,,,,,,,,,mobile-ICESpuPO1,1,cyt,W3181_1076.1W3181_1077,,1,,ICESpuPO1 integrase Int,int,,DNA mobilization,,,Integrase,,,,,,,,,,mobile-ICESpuPO1,1,cyt,W3181_1077W3181_1078,,1,,hypothetical protein,,,DNA mobilization,,,hypothetical protein,,,,,,,,,,mobile-ICESpuPO1,1,cyt,W3181_1078W3181_1079,,1,,PRTRC system protein D,,,DNA mobilization,,,Rod shape determination protein,,,,,,,,,,mobile-ICESpuPO1,1,cyt,W3181_1079W3181_1081,,1,,hypothetical protein,,,,,,hypothetical protein,,,,,,,,,,mobile-ICESpuPO1,1,cyt,W3181_1081W3181_1082,,1,,DNA polymerase V subunit UmuC,umuC,,stress - UV,,,Error-prone lesion bypass DNA polymerase V (UmuC),DNA repair bacterial UmuCD system,,,,,,,,,mobile-ICESpuPO1,1,cyt,Shw05351lW3181_1083,,1,,DNA polymerase V subunit UmuD,umuD,,DNA repair,,,Error-prone repair protein UmuD,DNA repair bacterial UmuCD system,,,,,,,,,mobile-ICESpuPO1,1,cyt,Shw04527jW3181_1084,,1,,Exonuclease RNase T and DNA polymerase III,,,stress - UV,,,DNA polymerase III epsilon subunit-like protein,,,,,,,,,,mobile-ICESpuPO1,1,cyt,W3181_1084W3181_1085,,1,,hypothetical protein,,,,,,hypothetical protein,,,,,,,,,,mobile-ICESpuPO1,1,cyt,W3181_1085W3181_1086,,2,,conserved hypothetical protein,,,1CP,,,COGs COG2378,,,,,,,,,,mobile-ICESpuPO1 GE:tRNA-Ser,1,cyt,Shw03617W3181_1087,,2,,type I restriction-modification system N6-adenine DNA methyltransferase HsdM,hsdM,,Type I Restriction-Modification,,,Type I restriction-modification system DNA-methyltransferase subunit M (EC 2.1.1.72),Restriction-Modification System; <br>Type I Restriction-Modification,,,,,,,,2.1.1.72,mobile-ICESpuPO1 GE:tRNA-Ser,1,cyt,Shw03618W3181_1088,,2,,type I restriction-modification system restriction endonuclease DNA specificity subunit HsdS,hsdS,,Type I Restriction-Modification,,,Type I restriction-modification system specificity subunit S (EC 3.1.21.3),Restriction-Modification System; <br>Type I Restriction-Modification,,,,,,,,3.1.21.3,mobile-ICESpuPO1 GE:tRNA-Ser,1,cyt,Shw03619W3181_1089,,3,,type I restriction-modification locus conserved hypothetical protein,,,Restriction modification - I,,,putative inner membrane protein,,,,,,,,,,mobile-ICESpuPO1 GE:tRNA-Ser,1,cyt,Shw04830W3181_1090,,2,,type I restriction-modification system restriction endonuclease cleavage subunit HsdR,hsdR,,Restriction modification - I,,,type I restriction enzyme HsdR putative,,,,,,,,,3.1.21.3,mobile-ICESpuPO1 GE:tRNA-Ser,1,cyt,Shw03620W3181_1091,,2,,type I RM system locus putative DNA helicase,,,Restriction modification - I,,,hypothetical protein,,,,,,,,,,mobile-ICESpuPO1 GE:tRNA-Ser,1,cyt,Shw03621W3181_1092,,2,,conserved hypothetical protein,,,Restriction modification - I,,,hypothetical protein,,,,,,,,,,mobile-ICESpuPO1 GE:tRNA-Ser,1,cyt,Shw03622W3181_1093,,2,,conserved hypothetical protein,,,Restriction modification - I,,,,,,,,,,,,,mobile-ICESpuPO1 GE:tRNA-Ser,1,cyt,Shw03623W3181_1094,,2,,conserved hypothetical protein with DUF457 domain,,,Restriction modification - I,,,membrane-bound metal-dependent hydrolase,,,,,,,,,,mobile-ICESpuPO1 GE:tRNA-Ser,1,peri,Shw03624W3181_1095,,2,,hypothetical protein,,,Restriction modification - I,,,hypothetical protein,,,,,,,,,,mobile-ICESpuPO1 GE:tRNA-Ser,1,cyt,Shw03625W3181_1096,,2,,hypothetical protein,,,Restriction modification - I,,,hypothetical protein,,,,,,,,,,mobile-ICESpuPO1 GE:tRNA-Ser,1,cyt,Shw03626W3181_1097,,2,,hypothetical protein,,,Restriction modification - I,,,hypothetical protein,,,,,,,,,,mobile-ICESpuPO1 GE:tRNA-Ser,1,cyt,Shw03627W3181_1098,,1,,IncJ-type conjugative system relaxase TraI,traI,,Secretion - conjugation - IncJ locus 1,,,Conjugative transfer protein TraI relaxase,Conjugative transfer related cluster,,,,,,,,,mobile-ICESpuPO1,1,cyt,W3181_1098W3181_1099,,1,,IncJ-type conugative system coupling protein TraD,traD,,Secretion - conjugation - IncJ locus 1,,,IncF plasmid conjugative transfer protein TraD,Conjugative transfer related cluster,,,,,,,,,mobile-ICESpuPO1,1,IM 2 TM,W3181_1099W3181_1100,,1,,IncJ-type conjugative system protein 234,,,Secretion - conjugation - IncJ locus 1,,,Conjugative transfer protein 234,Conjugative transfer related cluster,,,,,,,,,mobile-ICESpuPO1,1,cyt,W3181_1100W3181_1101,,1,,IncJ-type integrating conjugative element protein PFL4697-type,,,Secretion - conjugation - IncJ locus 1,,,Conjugative transfer protein s043,Conjugative transfer related cluster,,,,,,,,,mobile-ICESpuPO1,1,IM 4 TM,W3181_1101W3181_1102,,1,,IncJ-type conjugative transfer system uncharacterized protein,,,,,,hypothetical protein,,,,,,,,,,mobile-ICESpuPO1,1,cyt,W3181_1102W3181_1103,,1,,IncJ-type conjugative transfer system uncharacterized protein,,,,,,,,,,,,,,,,mobile-ICESpuPO1,1,cyt,W3181_1103W3181_1104,,1,,IncJ-type conjugative transfer system assembly protein TraL,traL,,Secretion - conjugation - IncJ locus II,,,IncF plasmid conjugative transfer pilus assembly protein TraL,Conjugative transfer related cluster,,,,,,,,,mobile-ICESpuPO1,1,IM 1 TM,W3181_1104W3181_1105,,1,,IncJ-type conjugative transfer system assembly protein TraE,traE,,Secretion - conjugation - IncJ locus II,,,IncF plasmid conjugative transfer pilus assembly protein TraE,Conjugative transfer related cluster,,,,,,,,,mobile-ICESpuPO1,1,peri,W3181_1105W3181_1106,,1,,IncJ-type conjugative transfer system secretin TraK,traK,,Secretion - conjugation - IncJ locus II,,,IncF plasmid conjugative transfer pilus assembly protein TraK,Conjugative transfer related cluster,,,,,,,1.B.22,,mobile-ICESpuPO1,1,OM,W3181_1106W3181_1107,,1,,IncJ-type conjugative transfer system assembly protein TraB,traB,,Secretion - conjugation - IncJ locus II,,,IncF plasmid conjugative transfer pilus assembly protein TraB,Conjugative transfer related cluster,,,,,,,,,mobile-ICESpuPO1,1,IM 1 TM,W3181_1107W3181_1108,,1,,IncJ-type conjugative transfer system lipoprotein TraV,traV,,Secretion - conjugation - IncJ locus II,,,Conjugative transfer protein TraV,Conjugative transfer related cluster,,,,,,,,,mobile-ICESpuPO1,1,LP-OM,W3181_1108W3181_1109,,1,,IncJ-type conjugative transfer pilin subunit TraA,traA,,Secretion - conjugation - IncJ locus II,,,Conjugative transfer protein TraA,Conjugative transfer related cluster,,,,,,,,,mobile-ICESpuPO1,1,IM 1 TM | surface structure,W3181_1109W3181_1110,,1,,Au+-exporting ATPase GolT,golT,,Transport | export - gold,,,Lead cadmium zinc and mercury transporting ATPase (EC 3.6.3.3) (EC 3.6.3.5); Copper-translocating P-type ATPase (EC 3.6.3.4),Copper homeostasis,,,,,,,3.A.3.5,,mobile-ICESpuPO1,1,IM 8 TM,W3181_1110W3181_1111,,1,,Au-responsive transcriptional regulator GolS,golS,,Gold resistance,,,Transcriptional regulator MerR family,Cobalt-zinc-cadmium resistance,,MerR,,,,,,,mobile-ICESpuPO1,1,cyt,W3181_1111W3181_1112^,,1,,transcriptional regulator MerR family,,,Sensory transduction,,,Transcriptional regulator MerR family,Cobalt-zinc-cadmium resistance,,MerR,,,,,,,mobile-ICESpuPO1,1,cyt,W3181_1112^W3181_1113,,1,,ISSpu5 helper protein,,,DNA mobilization - IS element,,,IstB-like ATP-binding protein,,,,,,,,,,mobile - ISSpu5,1,cyt,W3181_1113W3181_1114,,1,,ISSpu5 cointegrase,,,DNA mobilization - IS element,,,ISPsy14 transposase,,,,,,,,,,mobile - ISSpu5,1,cyt,W3181_1114W3181_1115^,,1,,hypothetical protein,,,,,,Lead cadmium zinc and mercury transporting ATPase (EC 3.6.3.3) (EC 3.6.3.5); Copper-translocating P-type ATPase (EC 3.6.3.4),Copper homeostasis,,,,,,,,,mobile-ICESpuPO1,1,cyt,W3181_1115^W3181_1116,,1,,ISSpu15 transposase OrfA,,,DNA mobilization - IS element,,,putative transposase,,,,,,,,,,mobile - ISSpu15,1,cyt,W3181_1116W3181_1117^,,1,,ISSpu15 transposase OrfB,,,DNA mobilization - IS element,,,IstB-like ATP-binding protein,,,,,,,,,,mobile - ISSpu15,1,cyt,W3181_1117^W3181_1119,,1,,ISShes1 transposase TnpA_ISShes1,tnpA_ISShes1,,DNA mobilization - IS element,,,putative transposase,,,,,,,,,,mobile - ISShes1,1,cyt,tnpa_ISShes1W3181_1120,,1,,Au responsive transcriptional regulator GolS,golS,,Gold resistance,,,Transcriptional regulator MerR family,Cobalt-zinc-cadmium resistance,,MerR,,,,,,,mobile-ICESpuPO1,1,cyt,W3181_1120W3181_1121^,,1,,ISPlu9-like transposase,,,DNA mobilization - IS element,,,,,,,,,,,,,mobile - IS,1,cyt,W3181_1121^W3181_1122,,1,,transcriptional regulator ArsR family,,,Heavy metal resistance,,,regulatory protein ArsR,,,,,,,,,,mobile-ICESpuPO1,1,cyt,W3181_1122W3181_1123^,,1,,dihydrolipoamide dehydrogenase,,,Heavy metal resistance,,,Dihydrolipoamide dehydrogenase of 2-oxoglutarate dehydrogenase (EC 1.8.1.4),Dehydrogenase complexes; <br>TCA Cycle,,,,,,,,,mobile-ICESpuPO1,1,cyt,W3181_1123^W3181_1124,,1,,antiport metal ion efflux permease ZitB,zitB,,Zinc homeostasis,,,Cobalt-zinc-cadmium resistance protein CzcD,CBSS-36873.1.peg.4752; <br>Cobalt-zinc-cadmium resistance,,,,,,,2.A.4.1,,mobile-ICESpuPO1,1,IM 5 TM,W3181_1124W3181_1125^,,1,,transcriptional regulator ArsR family,,,1CP - zinc?,,,,,,,,,,,,,mobile-ICESpuPO1,1,cyt,W3181_1125^W3181_1126,,1,,heavy metal translocating P-type ATPase,,,Heavy metal resistance,,,Lead cadmium zinc and mercury transporting ATPase (EC 3.6.3.3) (EC 3.6.3.5); Copper-translocating P-type ATPase (EC 3.6.3.4),Copper homeostasis,,,,,,,3.A.3.6,,mobile-ICESpuPO1,1,IM 6 TM,W3181_1126W3181_1128,,1,,ISShes1 transposase TnpA_ISShes1,tnpA_ISShes1,,DNA mobilization - IS element,,,putative transposase,,,,,,,,,,mobile - ISShes1,1,cyt,tnpa_ISShes1W3181_1129,,1,,Au+ efflux pump MFP component GesA,gesA,,Gold resistance,,,Probable Co/Zn/Cd efflux system membrane fusion protein / Multidrug efflux membrane fusion protein MexE,Cobalt-zinc-cadmium resistance,,,,,,,8.A.1,,mobile-ICESpuPO1,1,peri,W3181_1129W3181_1130,,1,,Au+ efflux pump permease component GesB,gesB,,Gold resistance,,,RND multidrug efflux transporter; Acriflavin resistance protein,Multidrug Resistance Efflux Pumps,,,,,,,2.A.6.2,,mobile-ICESpuPO1,1,IM 12 TM,Shw08055bW3181_1131,,1,,Au+ efflux pump outer membrane lipoprotein component GesC,gesC,,Gold resistance,,,RND efflux system outer membrane lipoprotein CmeC,Multidrug Resistance Efflux Pumps,,,,,,,1.B.17,,mobile-ICESpuPO1,1,LP-OM,W3181_1131W3181_1132^,,1,,Au+ efflux pump permease component GesB,gesB,,Gold resistance,,,transporter hydrophobe/amphiphile efflux-1 (HAE1) family,,,,,,,,2.A.6.2,,mobile-ICESpuPO1,1,IM 5 TM,Shw08055aW3181_1136,,1,,Au+ efflux pump chaperone component GolB,golB,,Gold resistance,,,,,,,,,,,,,mobile-ICESpuPO1,1,cyt,W3181_1136W3181_1137.1^ W3181_4109^,,1,,ISShes9-like transposase protein,,,DNA mobilization - IS element,,,,,,,,,,,,,mobile - IS,1,cyt,W3181_1137.1^W3181_1137^,,1,,transposase,,,DNA mobilization - IS element,,,,,,,,,,,,,mobile - IS,1,cyt,W3181_1137^W3181_1138,,1,,ISShes9 Orf2-like,,,DNA mobilization - IS element,,,hypothetical protein,,,,,,,,,,mobile - IS,1,cyt,W3181_1138W3181_1139,,1,,IncJ-type conjugative transfer system disulfide bond isomerase HtdT,htdT,,Secretion - conjugation - IncJ locus II,,,Thiol:disulfide involved in conjugative transfer,Conjugative transfer related cluster,,,,,,,,,mobile-ICESpuPO1,1,peri,W3181_1139W3181_1140,,1,,IncJ-type conjugative transfer system protein TraC,traC,,Secretion - conjugation - IncJ locus II,,,IncF plasmid conjugative transfer pilus assembly protein TraC,Conjugative transfer related cluster,,,,,,,,,mobile-ICESpuPO1,1,cyt-IM assoc,W3181_1140W3181_1141,,1,,IncJ-type conjugative transfer system protein 345,,trhF,Secretion - conjugation - IncJ locus II,,,Conjugative transfer protein 345,Conjugative transfer related cluster,,,,,,,,,mobile-ICESpuPO1,1,IM 1 TM,W3181_1141W3181_1142,,1,,IncJ-type conjugative transfer system signal peptidase TraF,traF,,Secretion - conjugation - IncJ locus II,,,Conjugative signal peptidase TrhF,Conjugative transfer related cluster,,,,,,,,,mobile-ICESpuPO1,1,IM 1 TM,W3181_1142W3181_1143,,1,,IncJ-type conjugative transfer system protein TraW,traW,,Secretion - conjugation - IncJ locus II,,,IncF plasmid conjugative transfer pilus assembly protein TraW,Conjugative transfer related cluster,,,,,,,,,mobile-ICESpuPO1,1,peri,W3181_1143W3181_1144,,1,,IncJ-type conjugative transfer system protein TraU,traU,,Secretion - conjugation - IncJ locus II,,,IncF plasmid conjugative transfer pilus assembly protein TraU,Conjugative transfer related cluster,,,,,,,,,mobile-ICESpuPO1,1,peri,W3181_1144W3181_1145,,1,,IncJ-type conjugative transfer system mating pair stabilization protein TraN,traN,,Secretion - conjugation - IncJ locus II,,,IncF plasmid conjugative transfer protein TraN,Conjugative transfer related cluster,,,,,,,,,mobile-ICESpuPO1,1,OM,W3181_1145W3181_1146,,1,,hypothetical protein,,,,,,hypothetical protein,,,,,,,,,,mobile-ICESpuPO1,1,IM 2 TM,W3181_1146W3181_1147,,1,,GTPase domain protein,,,,,,hypothetical protein,,,,,,,,,,mobile-ICESpuPO1,1,IM 3 TM,W3181_1147W3181_1148,,1,,hypothetical protein,,,,,,,,,,,,,,,,mobile-ICESpuPO1,1,cyt,W3181_1148W3181_1149,,1,,deoxyribonuclease I,,,,,,Endonuclease I precursor (EC 3.1.21.1),,,,,,,,,3.1.21.1,mobile-ICESpuPO1,1,extra,W3181_1149W3181_1150,,1,,hypothetical protein,,,,,,hypothetical protein,,,,,,,,,,mobile-ICESpuPO1,1,cyt,W3181_1150W3181_1151,,1,,hypothetical protein,,,,,,hypothetical protein,,,,,,,,,,mobile-ICESpuPO1,1,IM 1 TM,W3181_1151W3181_1152,,1,,single-strand binding protein,,,Secretion - conjugation - IncJ locus II,,,Single-stranded DNA-binding protein,DNA repair bacterial; <br>DNA repair bacterial RecFOR pathway,,,,,,,,,mobile-ICESpuPO1,1,cyt,W3181_1152W3181_1153,,1,,phage recombination protein Bet,,,DNA mobilization,,,Recombination protein BET,,,,,,,,,,mobile-ICESpuPO1,1,cyt,W3181_1153W3181_1153.1 W3181_4110,,1,,conserved hypothetical protein,,,,,,hypothetical protein,,,,,,,,,,mobile-ICESpuPO1,1,IM 1 TM,W3181_1153.1W3181_1154,,1,,phage-related protein predicted endonuclease-like,,,,,,DNA recombination protein,,,,,,,,,,mobile-ICESpuPO1,1,cyt,W3181_1154W3181_1155,,1,,ATPase associated with various cellular activities AAA_5,,,,,,Aerobic cobaltochelatase CobS subunit (EC 6.6.1.2),Coenzyme B12 biosynthesis,,,,,,,,,mobile-ICESpuPO1,1,cyt,W3181_1155W3181_1156,,1,,hypothetical protein,,,,,,hypothetical protein,,,,,,,,,,mobile-ICESpuPO1,1,cyt,W3181_1156W3181_1157,,1,,protein of unknown function DUF3150,,,,,,Cobalamine biosynthesis protein,,,,,,,,,,mobile-ICESpuPO1,1,cyt,W3181_1157W3181_1158,,1,,hypothetical protein,,,,,,hypothetical protein,,,,,,,,,,mobile-ICESpuPO1,1,cyt,W3181_1158W3181_1159,,1,,von Willebrand factor type A,,,,,,Plasmid associated gene product APECO1_O1R37,,,,,,,,,,mobile-ICESpuPO1,1,cyt,W3181_1159W3181_1160,,1,,putative DNA repair protein YfjY,yfjY,,DNA repair,,,DNA repair protein RadC,DNA repair bacterial,,,,,,,,,mobile-ICESpuPO1,1,cyt,W3181_1160W3181_1161,,1,,hypothetical protein,,,,,,hypothetical protein,,,,,,,,,,mobile-ICESpuPO1,1,cyt,W3181_1161W3181_1162,,1,,phage P4 alpha zinc-binding domain protein,,,Restriction modification,,,putative primase,,,,,,,,,,mobile-ICESpuPO1,1,cyt,W3181_1162W3181_1163,,1,,hypothetical protein,,,,,,hypothetical protein,,,,,,,,,,mobile-ICESpuPO1,1,cyt,W3181_1163W3181_1164,,3,,protein of unknown function DUF3703,,,Heavy metal resistance,,,,,,,,,,,,,mobile-ICESpuPO1,1,IM 2 TM,Shw04798W3181_1165,,3,,heavy metal efflux pump permease component CzcA family,,,Transport RND|export - heavy metals,,,Cobalt-zinc-cadmium resistance protein CzcA; Cation efflux system protein CusA,Cobalt-zinc-cadmium resistance; <br>Cobalt-zinc-cadmium resistance,,,,,,,2.A.6.1,,mobile-ICESpuPO1,1,IM 12 TM,Shw04797aW3181_1166,,3,,heavy metal efflux pump MFP component CzcB family,,,Transport RND|export - heavy metals,,,Probable Co/Zn/Cd efflux system membrane fusion protein,Cobalt-zinc-cadmium resistance,,,,,,,8.A.1,,mobile-ICESpuPO1,1,IM 1 TM,Shw04796aW3181_1167,,3,,heavy metal efflux pump outer membrane secretin component CzcC family,,,secretin RND - heavy metals,,,Cation efflux system protein,,,,,,,,1.B.17,,mobile-ICESpuPO1,1,OM,Shw04795aW3181_1168,,3,,heavy metal efflux pump-associated periplasmic metal chaperone,,,chaperone - heavy metal,,,hypothetical protein,,,,,,,,,,mobile-ICESpuPO1,1,peri,Shw04794aW3181_1169,,4,,cation efflux system permease putative,,,Transport - heavy metals,,,Co/Zn/Cd efflux system component,,,,,,,,2.A.4,,mobile - IS,1,IM 6 TM,Shw05425aW3181_1170,,3,,Cd(II)/Pb(II)-responsive transcriptional regulator MerR family,,,1CP - heavy metal detox,,,Cd(II)/Pb(II)-responsive transcriptional regulator,CBSS-36873.1.peg.4752; <br>Cobalt-zinc-cadmium resistance,,MerR,,,,,,,mobile-ICESpuPO1,1,cyt,Shw04793aW3181_1171,,3,,cation diffusion facilitator family transporter,,,Transport - heavy metals,,,Cobalt-zinc-cadmium resistance protein CzcD,CBSS-36873.1.peg.4752; <br>Cobalt-zinc-cadmium resistance,,,,,,,2.A.4,,mobile-ICESpuPO1,1,IM 6 TM,Shw04792aW3181_1172,,3,,UPF0060 family membrane protein YnfA,ynfA,,Transport - heavy metals?,,,Protein of unknown function UPF0060,,,,,,,,9.B.45.1,,mobile-ICESpuPO1,1,IM 4 TM,Shw04791aW3181_1173,,1,,IncJ-type conjugative transfer system assembly protein TraF,traF,,Secretion - conjugation - IncJ locus 4,,,IncF plasmid conjugative transfer pilus assembly protein TraF,Conjugative transfer related cluster,,,,,,,,,mobile-ICESpuPO1,1,peri,W3181_1173W3181_1174,,1,,IncJ-type conjugative transfer system assembly protein TraH,traH,,Secretion - conjugation - IncJ locus 4,,,IncF plasmid conjugative transfer pilus assembly protein TraH,Conjugative transfer related cluster,,,,,,,,,mobile-ICESpuPO1,1,OM,W3181_1174W3181_1175,,1,,IncJ-type conjugative transfer system assembly protein TraG,traG,,Secretion - conjugation - IncJ locus 4,,,IncF plasmid conjugative transfer protein TraG,Conjugative transfer related cluster,,,,,,,,,mobile-ICESpuPO1,1,IM 2 TM,W3181_1175W3181_1176,,1,,hypothetical protein,,,Secretion - conjugation - IncJ locus 4,,,,,,,,,,,,,mobile-ICESpuPO1,1,IM 4 TM,W3181_1176