W3181_1966,,7,,L-arabinolactonase AraL,araL,,L-Arabinose utilization,,,L-arabinolactonase (EC 3.1.1.15),L-Arabinose utilization,,,,,,,,3.1.1.15,mobile,1,cyt,Shw06219W3181_1967,,22,,aspartate aminotransferase AspC,aspC,,Glutamine Glutamate Aspartate and Asparagine Biosynthesis,,Dispensable,Aspartate aminotransferase (EC 2.6.1.1),Glutamine Glutamate Aspartate and Asparagine Biosynthesis; <br>Threonine and Homoserine Biosynthesis,,,,pyridoxyl phosphate (PLP),,,,2.6.1.1,core,1,cyt,Shw01903W3181_1969,,22,,3-phosphoshikimate 1-carboxyvinyltransferase AroA,aroA,,Common Pathway For Synthesis of Aromatic Compounds (DAHP synthase to chorismate),,Dispensable,5-Enolpyruvylshikimate-3-phosphate synthase (EC 2.5.1.19),Chorismate Synthesis; <br>Common Pathway For Synthesis of Aromatic Compounds (DAHP synthase to chorismate),,,,,,,,2.5.1.19,core,1,cyt,Shw01902W3181_1970,,22,,cytidylate kinase Cmk,cmk,,pyrimidine conversions,,Expected Essential,Cytidylate kinase (EC 2.7.4.14),pyrimidine conversions,,,,,,,,2.7.4.14,core,1,cyt,Shw01901W3181_1971,,22,,ribosomal protein S1 RpsA,rpsA,,Cell division,,Expected Essential,SSU ribosomal protein S1p,Cell division-ribosomal stress proteins cluster; <br>Ribosome SSU bacterial,,,,,,,,,core,1,cyt,Shw01900W3181_1972,,22,,integration host factor beta subunit IhfB,ihfB,,DNA structural protein,,Dispensable,Integration host factor beta subunit,DNA structural proteins bacterial,,,,,,,,,core,1,cyt,Shw01899W3181_1973,,22,,membrane protein of unknown function DUF1049,,,,,Expected Essential,Putative inner membrane protein,,,,,,,,,,core,1,IM 2 TM,Shw01898W3181_1974,,22,,predicted N-acetylglucosaminyl transferase YciM,yciM,,,,Unknown,Heat shock (predicted periplasmic) protein YciM precursor,,,,,,,,,,core,1,cyt,Shw01897W3181_1975,,22,,orotidine 5`-phosphate decarboxylase PyrF,pyrF,,De Novo Pyrimidine Synthesis,,Dispensable Unclear In Ecoli,Orotidine 5-prime-phosphate decarboxylase (EC 4.1.1.23),De Novo Pyrimidine Synthesis,,,,,,,,4.1.1.23,core,1,cyt,Shw01896W3181_1976,,20,,"2,4-dienoyl-CoA reductase",,,,,Unknown,Oxidoreductase short-chain dehydrogenase/reductase family,,,,,,,,,1.3.1.34,,1,cyt,Shw01895W3181_1977,,22,,protein of unknown function DUF2058,,,,,Dispensable,Nucleoprotein/polynucleotide-associated enzyme,,,,,,,,,,core,1,cyt,Shw01894W3181_1978,,22,22125499,butyryl-CoA dehydrogenase AcdS,acdS,,Butyrate metabolism,,Dispensable,Acyl-CoA dehydrogenase (EC 1.3.99.3),,,,,,,,,1.3.8.1,core,1,cyt,Shw01893W3181_1979,,22,,D-alanyl-D-alanine carboxypeptidase DacB,dacB,,peptidase,,Dispensable,D-alanyl-D-alanine carboxypeptidase (EC 3.4.16.4),CBSS-84588.1.peg.1247; <br>Murein Hydrolases; <br>Peptidoglycan Biosynthesis,,,S13,,,,,3.4.16.4,core,1,peri,Shw01892W3181_1980,,19,,hypothetical protein,,,,,Dispensable,hypothetical protein,,,,,,,,,,,1,IM 2 TM,Shw01891W3181_1981,,20,,protein of unknown function DUF1904,,,,,Unknown,hypothetical protein,,,,,,,,,,no Sden Sfri,1,cyt,Shw01890W3181_1982,,22,,phosphatidylserine synthase PssA,pssA,,Glycerolipid and Glycerophospholipid Metabolism,,Expected Essential,CDP-diacylglycerol--serine O-phosphatidyltransferase (EC 2.7.8.8),Glycerolipid and Glycerophospholipid Metabolism in Bacteria,,,,,,,,2.7.8.8,core,1,cyt-IM assoc,Shw01889W3181_1983,,15,,multidrug efflux protein EmrD,emrD,,Transport | export - aa?,,Dispensable,Multidrug resistance protein D,,,,,,,,2.A.1,,,1,IM 12 TM,Shw01888W3181_1984,,11,,class C beta-lactamase AmpC,ampC,,peptidase,,Dispensable,Beta-lactamase (EC 3.5.2.6),Beta-lactamase,,,S12.006,,,,,3.5.2.6,,1,peri,Shw01887W3181_1985,,22,,conserved hypothetical DTW domain protein,,,,,Dispensable,hypothetical protein,,,,,,,,,,core,1,cyt,Shw01886W3181_1986,,15,,monomeric alkaline phosphatase PhoX,phoX,,phosphate homeostasis,,Dispensable,Predicted phosphatase,,,,,,Ca,,,3.1.3.1,mobile?,1,LP-surface,Shw01885W3181_1987,,18,,hypothetical protein,,,,,Unknown,hypothetical protein,,,,,,,,,,mobile?,1,cyt,Shw01882W3181_1988,,20,,ATP-dependent DNA helicase RecQ family,,,DNA repair,,Dispensable,ATP-dependent DNA helicase RecQ family,DNA repair bacterial RecFOR pathway,,,,ATP,,,,3.6.1.-,,1,cyt,Shw01881W3181_1989,,17,,conserved hypothetical protein,,,,,,hypothetical protein,,,,,,,,,,mobile?,1,cyt,Shw06983W3181_1990,,20,,serine protease inhibitor ecotin EcoT,ecoT,,peptidase inhibitor,,Dispensable,Proteinase inhibitor I11 ecotin precursor,,,,I11,,,,,,core (paralog),1,peri,Shw01835aW3181_1991,,22,,drug:Na+ antiporter NorM,norM,,Transport ,,Dispensable,Multidrug resistance protein norM,,,,,,,,2.A.66.1,,core,1,IM 12 TM,Shw01818W3181_1992,,22,,"6,7-dimethyl-8-ribityllumazine synthase alpha subunit RibC",ribC,ribE,Cofactor FMN/FAD synth,,Surprise Dispensable,Riboflavin synthase alpha chain (EC 2.5.1.9),Riboflavin FMN and FAD metabolism; <br>riboflavin to FAD,,,,,,,,2.5.1.9,core,1,cyt,Shw01819W3181_1993,,22,,conserved hypothetical protein,,,chitin competence???,,Unknown,hypothetical protein,,,,,,,,,,core,1,cyt,Shw01820W3181_1994,,22,,threonyl-tRNA synthetase ThrS,thrS,,tRNA charging,,Expected Essential,Threonyl-tRNA synthetase (EC 6.1.1.3),tRNA aminoacylation Thr,,,,ATP,,,,6.1.1.3,core,1,cyt,Shw01822W3181_1995,,22,,translation initiation factor IF-3 InfC,infC,,Translation initiation factors,,Expected Essential,Translation initiation factor 3,Translation initiation factors bacterial,,,,,,,,,core,1,cyt,Shw01823W3181_1996,,22,,50S ribosomal protein L35 RpmI,rpmI,,Ribosome biogenesis - LSU,,New Essential,LSU ribosomal protein L35p,Ribosome LSU bacterial,,,,,,,,,core,1,cyt,Shw01824W3181_1997,,22,,50S ribosomal protein L20 RplT,rplT,,Ribosome biogenesis - LSU,,Expected Essential,LSU ribosomal protein L20p,Ribosome LSU bacterial,,,,,,,,,core,1,cyt,Shw01825W3181_1998,,22,,thioredoxin reductase TrxB,trxB,,Thioredoxin-disulfide reductase,,Dispensable,Thioredoxin reductase (EC 1.8.1.9),Thioredoxin-disulfide reductase; <br>pyrimidine conversions,,,,,,,,1.8.1.9,core,1,cyt,Shw01826W3181_1999,,22,,alanine dehydrogenase Ald,ald,,Branched chain aa synthesis,,,Alanine dehydrogenase (EC 1.4.1.1),Pyruvate Alanine Serine Interconversions,,,,NAD,,,,1.4.1.1,core,1,cyt,Shw01827W3181_2000,,22,,leucine-responsive regulatory protein Lrp,lrp,,1CP|global - leucine,,Unknown,Leucine-responsive regulatory protein regulator for leucine (or lrp) regulon and high-affinity branched-chain amino acid transport system,Branched-Chain Amino Acid Biosynthesis; <br>Glutamine Glutamate Aspartate and Asparagine Biosynthesis,,AsnC,,,,,,,core,1,cyt,Shw01828W3181_2001,,22,,double-stranded DNA translocase FtsK,ftsK,,Transport - Cell division,,Dispensable,Cell division protein FtsK,Bacterial Cell Division; <br>Bacterial Cytoskeleton; <br>Bacterial RNA-metabolizing Zn-dependent hydrolases,,,,ATP,,,3.A.12.1,,core,1,IM 5 TM,Shw01829W3181_2002,,22,,outer membrane lipoprotein carrier protein LolA,lolA,,protein sorting - lipoproteins,,Expected Essential,Outer membrane lipoprotein carrier protein LolA,Lipopolysaccharide assembly; <br>Lipoprotein sorting system,,,,,,,1.B.46,,core,1,peri,Shw01830W3181_2003,,22,,AAA ATPase family protein,,,,,Dispensable,ATPase AAA family,,,,,ATP,,,,,core,1,cyt,Shw01831W3181_2004,,22,,camphor resistance protein CrcB,crcB,,chromosome folding?,,Expected Essential,Protein crcB homolog,,,,,,,,9.B.71,,core,1,IM 4 TM,Shw01832W3181_2005,,22,,seryl-tRNA synthetase SerS,serS,,tRNA charging,,Expected Essential,Seryl-tRNA synthetase (EC 6.1.1.11),CBSS-326442.4.peg.1852; <br>Glycine and Serine Utilization; <br>tRNA aminoacylation Ser,,,,ATP,,,,6.1.1.11,core,1,cyt,Shw01833W3181_2006,,18,,hypothetical protein,,,,,Dispensable,hypothetical protein,,,,,,,,,,,1,IM 1 TM,Shw01834W3181_2007,,22,,tRNA 2-thiouridine synthesizing protein sulfur mediator TusE,tusE,,,,Unknown,tRNA 2-thiouridine synthesizing protein E (EC 2.8.1.-),CBSS-326442.4.peg.1852,,,,,,,,,core,1,cyt,Shw01880W3181_2008,,22,,tRNA 2-thiouridine synthesizing protein B subunit TusB,tusB,,,,Expected Essential,hypothetical protein,,,,,,,,,,core,1,cyt,Shw01879W3181_2009,,22,,tRNA 2-thiouridine synthesizing protein C subunit TusC,tusC,,,,Expected Essential,tRNA 5-methylaminomethyl-2-thiouridine synthase TusC,CBSS-326442.4.peg.1852,,,,,,,,,core,1,cyt,Shw01878W3181_2010,,22,,tRNA 2-thiouridine synthesizing protein D subunit TusD,tusD,,,,Expected Essential,tRNA 5-methylaminomethyl-2-thiouridine synthase TusD,CBSS-326442.4.peg.1852,,,,,,,,2.8.1.-,core,1,cyt,Shw01877W3181_2011,,22,,integral membrane FtsH interacting protein YccA,yccA,,Cell division,,Dispensable,Putative TEGT family carrier/transport protein,CBSS-326442.4.peg.1852,,,,,,,1.A.14.2,,core,1,IM 7 TM,Shw01876W3181_2012,,22,,transcriptional regulator YdhB,ydhB,,Sensory transduction,,Unknown,Hypothetical lysR-family transcriptional regulator YdhB,CBSS-326442.4.peg.1852,,LysR,,,,,,,core,1,cyt,Shw01875W3181_2013,,21,,drug:H+ antiporter DHA1 family,,,Transport | export,,Dispensable,Multidrug resistance transporter Bcr/CflA family,Copper homeostasis,,,,,,,2.A.1.2,,no Sden,1,IM 12 TM,Shw01874W3181_2014,,4,,hypothetical protein,,,,,,hypothetical protein,,,,,,,,,,mobile?,1,cyt,Shw05421aW3181_2014.1 W3181_4118,,21,,conserved hypothetical protein,,,ferredoxin?,,,hypothetical protein,,,,,,,,,,no PV4,1,cyt,Shw01872W3181_2015^,,18,,two component signal transduction system response regulator with DUF3369 and HD domains,,,2CP RR - orphan,,Dispensable,Response regulator,,,,,,metal,,,,hotspot for integration,1,cyt,Shw01871W3181_2017,,1,,sec-C metal-binding protein,,,,,,Response regulator,,,,,,,,,,mobile-TN3,1,cyt,W3181_2017W3181_2018,,1,,conserved hypothetical protein,,,,,,,,,,,,,,,,mobile-TN3,1,cyt,W3181_2018W3181_2019^,,1,,conserved hypothetical protein,,,,,,hypothetical protein,,,,,,,,,,mobile-TN3,1,UK,W3181_2019^W3181_2020,,1,,Tn3 family transposase,,,DNA mobilization - IS element,,,Tn5044 transposase,,,,,,,,,,mobile-TN3,1,cyt,W3181_2020W3181_2021,,1,,hypothetical protein,,,,,,hypothetical protein,,,,,,,,,,mobile-TN3,1,IM 1 TM,W3181_2021W3181_2022,,1,,conserved hypothetical protein,,,,,,hypothetical protein,,,,,,,,,,mobile-TN3,1,cyt,W3181_2022W3181_2023,,3,,cointegrate resolution protein TnpS,tnpS,,DNA mobilization - IS element,,,cointegrate resolution protein S,,,,,,,,,,mobile-TN3,1,cyt,Shw04799W3181_2024,,3,,toxin-antitoxin system toxin GNAT acetyltransferase family,,,toxin-antitoxin,,,GCN5-related N-acetyltransferase; Histone acetyltransferase HPA2 and related acetyltransferases,,,,,,,,,,mobile-TN3,1,cyt,Shw04800W3181_2025,,3,,toxin-antitoxin system antidote Rhh family,,,toxin-antitoxin,,,hypothetical protein,,,,,,,,,,mobile-TN3,1,cyt,Shw04801W3181_2026,,3,,cointegrate resolution protein TnpT,tnpT,,DNA mobilization - IS element,,,Signal recognition particle receptor protein FtsY (=alpha subunit) (TC 3.A.5.1.1),Bacterial Cell Division; <br>Two cell division clusters relating to chromosome partitioning; <br>Universal GTPases,,,,,,,,,mobile-TN3,1,cyt,Shw04802aW3181_2027,,2,,thioesterase superfamily protein,,,stress - singlet oxygen,,,Thioesterase family protein,,,,,,,,,,mobile-TN3,1,cyt,Shw03518W3181_2028,,2,,thioesterase,,,stress - singlet oxygen,,,uncharacterized domain 1,,,,,,,,,,mobile-TN3,1,cyt,Shw03519W3181_2029,,2,,aldo/keto reductase,,,stress - singlet oxygen,,,Oxidoreductase,,,,,,,,,,mobile-TN3,1,cyt,Shw03520W3181_2030,,2,,transcriptional regulator TetR family,,,stress - singlet oxygen,,,,,,,,,,,,,mobile-TN3,1,cyt,Shw03521W3181_2031,,2,,anti-ECF sigma factor ChrR,chrR,,1CP|sigma antagonist - singlet oxygen stress,,,hypothetical protein,,,,,,,,,,mobile-TN3,1,cyt,Shw03522W3181_2032,,2,,glutathione S-transferase GTT2-like subfamily,,,Glutathione: Non-redox reactions,,,Glutathione S-transferase (EC 2.5.1.18),Glutathione: Non-redox reactions,,,,,,,,,mobile-TN3,1,cyt,Shw03523W3181_2033,,3,,lipid A 3-O-deacylase PagL family,,,secretin - FA,,,hypothetical protein,,,,,,,,,,mobile-TN3,1,OM,Shw04593W3181_2034^,,2,,ISPa13-like transposase,,,DNA mobilization - IS element,,,hypothetical protein,,,,,,,,,,mobile - IS,1,cyt,Shw03524W3181_2037^,,2,,ISShfr1-like transposase,,,DNA mobilization - IS element,,,transposase IS4 family protein,,,,,,,,,,mobile - IS,1,cyt,Shw03525W3181_2038^,,3,,ISSpu1 transposase TnpA_ISSpu1,tnpA_ISSpu1,,DNA mobilization - IS element,,,Transposase,,,,,,,,,,mobile - ISSpu1,1,cyt,tnpa_ISSpu1W3181_2039,,1,,ISSpu10 transposase TnpA_ISSpu10,tnpA_ISSpu10,,DNA mobilization - IS element,,,ISSod6 transposase,,,,,,,,,,mobile - ISSpu10,1,cyt,tnpa_ISSpu10W3181_2040,,1,,methyl-accepting chemotaxis sensory transducer with 4HB sensory domain,,,Chemotaxis sensor 4HB_MCP,,,methyl-accepting chemotaxis sensory transducer,,,,,,,,,,mobile-TN3,1,IM 2 TM,Shw04687bW3181_2041,,1,,transcriptional regulator TetR family,,,Sensory transduction,,,Transcriptional regulator TetR family,,,TetR,,,,,,,mobile-TN3,1,cyt,W3181_2041W3181_2042,,1,,endoribonuclease L-PSP,,,inhibitor protein synth,,,Putative translation initiation inhibitor yjgF family,,,,,,,,,,mobile-TN3,1,cyt,W3181_2042W3181_2043,,1,,ISSpu10 transposase TnpA_ISSpu10,tnpA_ISSpu10,,DNA mobilization - IS element,,,ISSod6 transposase,,,,,,,,,,mobile - ISSpu10,1,cyt,tnpa_ISSpu10W3181_2045,,22,,conserved hypothetical lipoprotein,,,,,Unknown,hypothetical protein,,,,,,,,,,core,1,LP-OM,Shw01870W3181_2046,,22,,Cbb3-type cytochrome c oxidase subunit I CcoN,ccoN,,Electron transfer - O2 high affinity,Fnr,Dispensable,Cytochrome c oxidase subunit CcoN (EC 1.9.3.1),Terminal cytochrome C oxidases,,,,heme b heme b3CuB,,,3.D.4,1.9.3.1,core,1,IM 12 TM,Shw01869W3181_2047,,22,,Cbb3-type cytochrome c oxidase subunit II CcoO,ccoO,,Electron transfer - O2 high affinity,Fnr,Dispensable,Cytochrome c oxidase subunit CcoO (EC 1.9.3.1),Terminal cytochrome C oxidases,,,,heme c,Cu,,3.D.4,1.9.3.1,core,1,IM 1 TM,Shw01868W3181_2048,,22,,Cbb3-type cytochrome c oxidase subunit IV CcoQ,ccoQ,,Electron transfer - O2 high affinity,Fnr,Dispensable,Cytochrome c oxidase subunit CcoQ (EC 1.9.3.1),Terminal cytochrome C oxidases,,,,,,,3.D.4,1.9.3.1,core,1,IM 1 TM,Shw01867W3181_2049,,22,,Cbb3-type cytochrome c oxidase subunit III CcoP,ccoP,,Electron transfer - O2 high affinity,Fnr,Dispensable,Cytochrome c oxidase subunit CcoP (EC 1.9.3.1),Terminal cytochrome C oxidases,,,,heme c (2),,,3.D.4,1.9.3.1,core,1,IM 2 TM,Shw01866W3181_2050,,22,,Cbb3-type cytochrome oxidase assembly protein CcoH,ccoH,,Electron transfer - O2 high affinity,Fnr,Dispensable,Putative analog of CcoH COG3198,Biogenesis of cbb3-type cytochrome c oxidases,,,,,,,,,core,1,IM 1 TM,Shw01865W3181_2051,,22,,Cbb3-type cytochrome oxidase-associated copper translocating P-ATPase CcoI,ccoI,,Electron transfer - O2 high affinity,Fnr,Dispensable,Type cbb3 cytochrome oxidase biogenesis protein CcoI; Copper-translocating P-type ATPase (EC 3.6.3.4),Biogenesis of cbb3-type cytochrome c oxidases; <br>Copper homeostasis,,,,ATP,,Cu,3.A.3,,core,1,IM 8 TM,Shw01864W3181_2052,,22,,Cbb3-type cytochrome oxidase assembly protein CcoS,ccoS,,Electron transfer - O2 high affinity,Fnr,Unknown,Type cbb3 cytochrome oxidase biogenesis protein CcoS involved in heme b insertion,Biogenesis of cbb3-type cytochrome c oxidases; <br>Terminal cytochrome C oxidases,,,,,,,,,core,1,IM 1 TM,Shw01863W3181_2053,,22,22125499,Cbb3-type cytochrome oxidase assembly protein disulfide bond oxidoreductase DsbD family,,,Electron transfer - O2 high affinity,Fnr,Dispensable,Heavy-metal-associated domain (N-terminus) and membrane-bounded cytochrome biogenesis cycZ-like domain possible membrane copper tolerance protein,,,,,,,,5.A.1,,core,1,IM 6 TM,Shw01862W3181_2054,,22,,oxygen-responsive transcriptional regulator of anaerobiosis response Fnr,fnr,,1CP|global - anaerobiosis (EtrA),Fnr,Unknown,Fumarate and nitrate reduction regulatory protein,Oxidative stress,,Crp,,,FeS,,,,core,1,cyt,Shw01861W3181_2055,,22,,universal stress protein UspE,uspE,,Universal stress protein family,Fnr,Dispensable,Universal stress protein E,Universal stress protein family,,,,,PO4,,,,core,1,cyt,Shw01860W3181_2056,,22,,tRNA(Cytosine32)-2-thiocytidine synthetaseYdaO,ydaO,ttcA,,,Unknown,tRNA(Cytosine32)-2-thiocytidine synthetase,CBSS-326442.4.peg.1852,,,,ATP,,,,,core,1,cyt,Shw01859W3181_2057,,22,,protein of unknown function DUF2987,,,,,Dispensable,hypothetical protein,,,,,,,,,,core,1,peri,Shw01858W3181_2058,,21,,glycoside hydrolase family 73,,,,,Dispensable,bax protein putative,,GH73,,,,,,,3.2.1.-,no Sden,1,IM 1 TM,Shw01857W3181_2059,,22,,protein of unknown function UPF0052,,,,,Unknown,Putative structural protein,,,,,,,,,,core,1,cyt,Shw01856W3181_2060,,22,,aspartate aminotransferase AspC,aspC,,Glutamine Glutamate Aspartate and Asparagine Biosynthesis,,Dispensable,Aspartate aminotransferase (EC 2.6.1.1),Glutamine Glutamate Aspartate and Asparagine Biosynthesis; <br>Threonine and Homoserine Biosynthesis,,,,pyridoxyl phosphate (PLP),,,,2.6.1.1,core,1,cyt,Shw01855W3181_2061,,22,,protein of unknown function DUF1315,,,,,Dispensable,Uncharacterized protein YeaC,,,,,,,,,,core,1,cyt,Shw01917W3181_2062,,22,,putative membrane protein,,,,,Unknown,hypothetical protein,,,,,,,,,,core,1,IM 2 TM,Shw01918W3181_2063,,22,,zinc carboxypeptidase domain protein,,,Proteolysis,,Dispensable,Zinc carboxypeptidase domain protein,,,,,,,,,,core,1,cyt,Shw01919W3181_2064,,22,,two component signal transduction system response regulator,,,Iron homeostasis,Fur,Dispensable,Transcriptional regulatory protein CpxR,,,,,,,,,,core,1,cyt-IM assoc,Shw01920W3181_2067,,1,,ISSpu6 transposase TnpA_ISSpu6,tnpA_ISSpu6,,DNA mobilization - IS element- interrupts W3181_2068,,,hypothetical protein,,,,,,,,,,mobile - ISSpu6,1,cyt,tnpa_ISSpu6W3181_2068^,,20,,ArgR-regulated TonB-dependent receptor,,,Omp TonB|induced by EPA depletion,ArgR,Dispensable,TonB-dependent receptor,Ton and Tol transport systems,,,,,,,1.B.14,,,1,OM,Shw01921W3181_2069,,22,,Holliday junction DNA helicase RuvB,ruvB,,DNA-replication,,Unknown,Holliday junction DNA helicase RuvB,DNA-replication; <br>RuvABC plus a hypothetical,,,,,,,,3.1.22.4,core,1,cyt,Shw01922W3181_2070,,22,,Holliday junction DNA helicase RuvA,ruvA,,DNA-replication,,Unknown,Holliday junction DNA helicase RuvA,DNA-replication; <br>RuvABC plus a hypothetical,,,,,,,,3.1.22.4,core,1,cyt,Shw01923W3181_2071,,22,,crossover junction endodeoxyribonuclease RuvC,ruvC,,DNA-replication,,Expected Essential,Crossover junction endodeoxyribonuclease RuvC (EC 3.1.22.4),DNA-replication; <br>RuvABC plus a hypothetical,,,,,,,,3.1.22.4,core,1,cyt,Shw01924W3181_2072,,22,,DNA-binding regulatory protein YebC,yebC,,RuvABC associated,,Expected Essential,FIG000859: hypothetical protein,RuvABC plus a hypothetical,,,,,,,,,core,1,cyt,Shw01925W3181_2073,,22,,aspartyl-tRNA synthetase AspS,aspS,,tRNA charging,,Expected Essential,Aspartyl-tRNA synthetase (EC 6.1.1.12),tRNA aminoacylation Asp and Asn,,,,ATP,,,,6.1.1.12,core,1,cyt,Shw01926W3181_2074,,22,,bifunctional periplasmic substrate binding protein/cytoplasmic diguanylate cyclase,,,Sensory transduction,,Dispensable,Signaling protein with a periplasmic binding domain and GGDEF domain,,,,,,,,,2.7.7.65,core,1,IM 1 TM,Shw01927W3181_2075,,22,,tRNA (uridine-5-oxyacetic acid methyl ester) 34 synthase CmoA,cmoA,,tRNA modification,,Dispensable,tRNA (uridine-5-oxyacetic acid methyl ester) 34 synthase,,,,,SAM,,,,2.1.1.-,core,1,cyt,Shw01928W3181_2076,,22,,tRNA (5-methoxyuridine) 34 synthase CmoD,cmoB,,tRNA modification,,Dispensable Unclear In Ecoli,tRNA (5-methoxyuridine) 34 synthase,,,,,,,,,,core,1,cyt,Shw01929W3181_2077,,22,,Zn-dependent oligopeptidase,,,,,Dispensable,hypothetical protein,,,,,,,,,,core,1,OM,Shw01930W3181_2078,,20,,transcriptional regulator LysR family,,,Sensory transduction,,Unknown,Transcriptional regulator LysR family,,,LysR,,,,,,,no Spea Shal,1,cyt,Shw01931W3181_2079,,18,,serine rich protein,,,,,Dispensable,SrpA-related protein,,,,,,,,,,,1,cyt,Shw01932W3181_2080,,22,,protein with c-terminal DUF1078 domain,,,,,,hypothetical protein,,,,,,,,,,core,1,cyt,Shw01933W3181_2081,,22,,thiazole biosynthesis protein ThiH,thiH,,Cofactor thiamine synth,,Dispensable,Thiazole biosynthesis protein ThiH,Thiamin biosynthesis,,,,SAM,4Fe4S,,,,core,1,cyt,Shw01934W3181_2082,,22,,thiazole-phosphate synthase ThiG,thiG,,Cofactor thiamine synth,,New Essential,Thiazole biosynthesis protein ThiG,Thiamin biosynthesis,,,,,,,,,core,1,cyt,Shw01935W3181_2083,,22,,sulphur carrier protein ThiS,thiS,,Cofactor thiamine synth,,New Essential,Sulfur carrier protein ThiS,Thiamin biosynthesis,,,,,,,,,core,1,cyt,Shw01936W3181_2084,,22,,adenylyltransferase ThiF,thiF,,Cofactor thiamine synth,,Dispensable,Sulfur carrier protein adenylyltransferase ThiF,Thiamin biosynthesis,,,,,,,,2.7.7.-,core,1,cyt,Shw01937W3181_2085,,22,,bifunctional hydroxy-(phospho)methylpyrimidine kinase/thiamine-phosphate pyrophosphorylase ThiDE,thiDE,,Cofactor thiamine synth,,Dispensable,Phosphomethylpyrimidine kinase (EC 2.7.4.7) / Thiamin-phosphate pyrophosphorylase (EC 2.5.1.3),Thiamin biosynthesis; <br>Thiamin biosynthesis,,,,,,,,"2.7.4.7, 2.5.1.3",core,1,cyt,Shw01938W3181_2086,,22,,thiamin biosynthesis protein ThiC,thiC,,Cofactor thiamine synth,,Dispensable,Thiamin biosynthesis protein ThiC,Thiamin biosynthesis,,,,,,,,,core,1,cyt,Shw01939W3181_2087,,20,,hypothetical protein,,,,,Unknown,hypothetical protein,,,,,,,,,,,1,IM 1 TM,Shw01940W3181_2088,,22,,channel protein hemolysin III family subfamily YqfA,yqfA,,fatty acid biosynthesis,FabR,Unknown,COG1272: Predicted membrane protein hemolysin III homolog,,,,,,,,9.B.30,,core,1,IM 7 TM,Shw01941W3181_2089,,17,,DTW domain containing protein,,,,,,hypothetical protein,,,,,,,,,,,1,cyt,Shw06981W3181_2090,,20,,MutT/nudix family protein,,,,,Unknown,MutT/nudix family protein,,,,,,,,,3.6.1.-,,1,cyt,Shw01942W3181_2091,,3,,diguanylate cyclase/phosphodiesterase with PAS/PAC and GAF sensor(s),,,Sensory transduction,,,diguanylate cyclase/phosphodiesterase (GGDEF & EAL domains) with PAS/PAC sensor(s),Bacterial hemoglobins,,,,,,,,2.7.7.65,,1,IM 5 TM,Shw04732W3181_2092,,19,,tRNA (adenine22-N1)-methyltransferase TrmK,trmK,,tRNA modification,,Unknown,hypothetical protein,rRNA modificaiton,,,,SAM,4Fe-4S,,,2.1.1.217,,1,cyt,Shw01943W3181_2093,,12,,universal stress protein family,,,Universal stress protein family,,,Universal stress protein family 6,Universal stress protein family,,,,,,,,,,1,cyt,Shw06727aW3181_2094,,10,,transcriptional regulator AraC family,,,Sensory transduction,,,Transcriptional regulator AraC family,,,AraC,,,,,,,,1,cyt,Shw06601W3181_2095,,18,,alkylhydroperoxidase like protein AhpD family,,,Oxidative stress,,,Mll1641 protein,,,,,,,,,,,1,cyt,Shw07016W3181_2096,,20,,SAM-dependent methyltransferase,,,,,Dispensable,Methyltransferase (EC 2.1.1.-),,,,,SAM,,,,,,1,cyt,Shw01945W3181_2096.1^ W3181_4119^,,8,,alpha/beta hydrolase fold,,,,,,,,,,,,,,,,,1,cyt,Shw06425W3181_2097,,11,,protein of unknown function YciI,yciI,,,,Dispensable,hypothetical protein,,,,,,,,,,,1,cyt,Shw01948W3181_2098,,10,,transcriptional regulator AraC family,,,Sensory transduction,,,Transcriptional regulator AraC family,,,AraC,,,,,,,mobile?,1,cyt,Shw06602W3181_2099,,10,,sodium/sulphate symporter,,,Transport Na Transport|symport,,,Di- and tricarboxylate transporters,,,,,,,,2.A.47,,mobile?,1,IM 12 TM,Shw06603W3181_2100,,14,,cupin family protein,,,,,,Putative cytoplasmic protein,,,,,,,,,,,1,cyt,Shw06829W3181_2101,,7,,hypothetical protein,,,,,Dispensable,hypothetical protein,,,,,,,,,,,1,cyt,Shw01773W3181_2102,,7,,protein of unknown function DUF1801,,,,,,hypothetical protein,,,,,,,,,,,1,cyt,Shw06220W3181_2103,,20,,periplasmic nitrate reductase membrane anchored tetracytochrome c component NapC,napC,,Electron transfer - nitrate (NapC-dependent),,,Cytochrome c-type protein NapC,Nitrate and nitrite ammonification,,,,heme c,,,5.A.3,,,1,IM 1 TM,Shw07157W3181_2104,,20,,NapC-dependent periplasmic nitrate reductase cytochrome c subunit NapB,napB,,Electron transfer - nitrate (NapC-dependent),,,Nitrate reductase cytochrome c550-type subunit,Nitrate and nitrite ammonification,,,,heme c,,,5.A.3,,,1,peri,Shw07156W3181_2105,,20,,NapC-dependent periplasmic nitrate reductase molybdopterin-binding subunit NapA,napA,,Electron transfer - nitrate (NapC-dependent),,,Periplasmic nitrate reductase precursor (EC 1.7.99.4),Nitrate and nitrite ammonification,,,,,,,5.A.3,1.7.99.4,,1,peri,Shw00692bW3181_2106,,20,,NapC-dependent nitrate reductase chaperone NapD,napD,,Electron transfer - nitrate (NapC-dependent),,,Periplasmic nitrate reductase component NapD,Nitrate and nitrite ammonification,,,,,,,,,,1,cyt,Shw07154W3181_2107,,17,,periplasmic nitrate reductase system transmembrane component NapE,napE,,Electron transfer - nitrate (NapC-dependent),,,Periplasmic nitrate reductase component NapE,Nitrate and nitrite ammonification,,,,,,,,,,1,IM 1 TM,Shw06998W3181_2108,,22,,ATP-dependent helicase HrpA,hrpA,,,,Dispensable,ATP-dependent helicase HrpA,,,,,ATP,,,,,core,1,cyt,Shw01772W3181_2109,,22,,CBS domain containing protein,,,,,Dispensable,CBS domain protein,,,,,,,,,,core,1,cyt,Shw01771W3181_2110,,21,,bifunctional isoaspartyl dipeptidase / l-asparaginase IaaA,iaaA,,Protein degradation,,Dispensable,Isoaspartyl aminopeptidase (EC 3.4.19.5) & Asp-X dipeptidase,Protein degradation,,,T02,,,,,"3.4.19.5, 3.5.1.1",no Sden,1,peri,Shw01698W3181_2111,,22,,outer membrane protein Omp85 family,,,secretion - 2 partner,,Dispensable,Outer membrane protein,,,,,,,,1.B.33.1,,core,1,OM,Shw01697W3181_2112,,22,,outer membrane protein with carboxy terminal DUF490 domain,,,substrate 2 partner,,Dispensable,putative exported protein,,,,,,,,9.B.22,,core,1,OM,Shw01696aW3181_2113,,21,,50S ribosomal protein L25 RplY,rplY,,Ribosome biogenesis - LSU,,Unknown,LSU ribosomal protein L25p,Ribosome LSU bacterial,,,,,,,,,core? (check Sben),1,cyt,Shw01695W3181_2114,,11,,hypothetical protein,,,junk?,,Dispensable,hypothetical protein,,,,,,,,,,shewanella only,1,cyt,Shw01694W3181_2115,,21,,peptidase family M15,,,peptidase,,Expected Essential,FIG001587: exported protein,CBSS-228400.4.peg.1623,,,M15A,,,,,,core? (check Sben),1,peri,Shw01693