W3181_2955,,16,,UPF0597 family protein,,,,,Dispensable,Putative inner membrane protein,,,,,,,,,,,1,cyt,Shw01151W3181_2956,,15,,PAS sensory domain protein YheO,yheO,,,,Dispensable,YheO-like PAS domain,,,,,,,,,,,1,cyt,Shw01150W3181_2957,,8,,RCC1/BLIP-II superfamily protein,,,,,Dispensable,lipoprotein putative,,,,,,,,,,,1,IM 1 TM,Shw01149W3181_2958,,22,,membrane protein of unknown function DUF368,,,,,Dispensable,Integral membrane protein,,,,,,,,,,core,1,IM 8 TM,Shw01148W3181_2959,,22,,conserved hypothetical protein,,,,,Unknown,hypothetical protein,,,,,,,,,,core,1,cyt,Shw01147W3181_2960,,11,,cytosine deaminase,,,pyrimidine conversions,,Unknown,Cytosine deaminase (EC 3.5.4.1),CBSS-326442.4.peg.1852; <br>Creatine and Creatinine Degradation; <br>pyrimidine conversions,,,,,,,,3.5.4.1,,1,cyt,Shw01146W3181_2961,,15,,membrane protein of unknown function DUF418,,,Transport - xanthosine?,,Dispensable,Putative inner membrane protein,,,,,,,,,,,1,IM 9 TM,Shw01145W3181_2962,,22,,membrane protein of unknown function DUF1294,,,,,Dispensable,Integral membrane protein,,,,,,,,,,core,1,IM 3 TM,Shw01144W3181_2963,,12,,short chain fatty acids transporter AtoE,atoE,,Transport | uptake - FA:H+,,Dispensable,Short chain fatty acids transporter,Polyhydroxybutyrate metabolism,,,,,,,2.A.73,,,1,IM 11 TM,Shw01141W3181_2964,,22,,peptidyl-prolyl cis-trans isomerase FklB,fklB,,,,Unknown,FKBP-type peptidyl-prolyl cis-trans isomerase / Macrophage infectivity potentiator,,,,,,,,,5.2.1.8,core,1,IM 1 TM,Shw01140W3181_2965,,16,,ROK family protein,,,,,Unknown,ROK family protein in a cluster with chitinase,,,,,,,,,,,1,cyt,Shw01139W3181_2966,,22,,aminopeptidase P AmpP,ampP,,Aminopeptidase,,Dispensable,Xaa-Pro aminopeptidase (EC 3.4.11.9),Aminopeptidases (EC 3.4.11.-); <br>CBSS-87626.3.peg.3639,,,M24B,,,,,3.4.11.9,core,1,cyt,Shw01138W3181_2967^,,10,,HD domain protein,,,,,Dispensable,Response regulator,,,,,,,,,,,1,IM 5 TM,Shw01137W3181_2968,,16,,chemotaxis signal transduction system methyl accepting sensory transducer with PAS sensory domain,,,Chemotaxis,,Dispensable,Methyl-accepting chemotaxis sensory transducer with Pas/Pac sensor,,,,,,,,,,,1,IM 1 TM,Shw01136W3181_2969,,22,,ATP-dependent RNA helicase DEAD box family,,,ATP-dependent RNA helicases,,Dispensable,ATP-dependent RNA helicase VVA0939,ATP-dependent RNA helicases bacterial,,,,ATP,,,,3.6.4.13,core,1,cyt,Shw01135W3181_2970,,7,,hypothetical protein,,,,,Dispensable,hypothetical protein,,,,,,,,,,,1,cyt,Shw01134W3181_2971,,22,,protein of unknown function DUF2913,,,,,Unknown,hypothetical protein,,,,,,,,,,core,1,cyt,Shw01132W3181_2972,,8,,conserved hypothetical protein,,,,,Unknown,hypothetical protein,,,,,,,,,,,1,cyt,Shw01131W3181_2973,,7,,peptidase family 56,,,peptidase,,Unknown,ThiJ/PfpI family protein,,,,C56,,,,,,,1,cyt,Shw01130W3181_2974,,8,,conserved hypothetical protein associated with aldehytde:ferredoxin oxidoreductase YdhW,ydhW,,respiration,,,hypothetical protein,,,,,,,,,,,1,cyt,Shw06395W3181_2975,,8,,aldehyde ferredoxin oxidoreductase YdhV,ydhV,,respiration,,,hypothetical protein,,,,,,tungsten?,,,1.2.7.5,,1,peri,Shw06396W3181_2976,,8,,4Fe-4S ferredoxin YdhY,ydhY,,respiration,,,Iron-sulfur cluster-binding protein,,,,,,4Fe-4S,,,1.2.7.5,,1,LP-OM,Shw06397W3181_2977,,7,,extracellular respiratory system surface undecaheme cytochrome c component UndD,undD,,respiration,,,83 kDa decaheme outer membrane cytochrome c,,,,,heme c,,,,,,1,LP-surface,Shw06197W3181_2978,,16,,putative negative regulator of univalent cation permeability,,,euk domain,,Dispensable,Putative membrane protein,,,,,,,,,,,1,IM 1 TM,Shw01129W3181_2979,,18,,integral membrane protein of unknown function DUF1449,,,,,Dispensable,Putative inner membrane protein,,,,,,,,,,no Sden Spea Shal Ssed,1,IM 3 TM,Shw01128W3181_2980,,22,,acteyltransferase GNAT family,,,resistance to antibiotics,,Dispensable,Acetyltransferase GNAT family,,,,,,,,,,core,1,cyt,Shw01126W3181_2981,,14,,inner membrane protein of unknown function DUF486,,,,,Unknown,hypothetical protein,,,,,,,,,,,1,IM 4 TM,Shw01125W3181_2982,,22,,protein of unknown function DUF2960,,,,,Unknown,hypothetical protein,,,,,,,,,,core,1,cyt,Shw01124W3181_2983,,22,,RDD family protein,,,,,Dispensable,hypothetical protein,,,,,,,,,,core,1,IM 3 TM,Shw01123W3181_2984,,22,,ABC-type lipopolysaccharide export system permease component 2 LptG,lptG,,Transport | export - LPS,,Expected Essential,FIG000906: Predicted Permease,CBSS-208964.1.peg.3826,,,,,,,3.A.1,,core,1,IM 6 TM,Shw01122W3181_2985,,22,,ABC-type lipopolysaccharide export system permease component 1 LptF,lptF,,Transport | export - LPS,,Expected Essential,FIG000988: Predicted permease,CBSS-208964.1.peg.3826,,,,,,,3.A.1,,core,1,IM 6 TM,Shw01121W3181_2986,,22,,cytoplasmic leucine metal-dependent aminopeptidase PepA,pepA,,Aminopeptidase,,Dispensable,Cytosol aminopeptidase PepA (EC 3.4.11.1),Aminopeptidases (EC 3.4.11.-); <br>CBSS-208964.1.peg.3826; <br>Dehydrogenase complexes,,,M17,,Zn,,,3.4.11.1,core,1,cyt,Shw01120W3181_2986.1 W3181_4132,,22,,pheA operon attenuation leader peptide PheL,pheL,,attenuation -Phe,,,,,,,,,,phe-tRNA,,,core,1,cyt,Shw01119W3181_2987,,22,,multifunctional chorismate mutase P/prephenate dehydratase/DAHP synthetase PheA,pheA,,Common Pathway For Synthesis of Aromatic Compounds (DAHP synthase to chorismate),,Dispensable,Chorismate mutase I (EC 5.4.99.5) / Prephenate dehydratase (EC 4.2.1.51) / 2-keto-3-deoxy-D-arabino-heptulosonate-7-phosphate synthase I beta (EC 2.5.1.54),Chorismate Synthesis; <br>Chorismate Synthesis; <br>Chorismate Synthesis; <br>Common Pathway For Synthesis of Aromatic Compounds (DAHP synthase to chorismate); <br>Phenylalanine and Tyrosine Branches from Chorismate; <br>Phenylalanine and Tyrosine Branches from Chorismate,,,,,Cd,,,"5.4.99.5, 4.2.1.51, 2.5.1.54",core,1,cyt,Shw01118W3181_2988,,22,,conserved hypothetical membrane protein,,,,,Dispensable,hypothetical protein,,,,,,,,,,core,1,IM 2 TM,Shw01116W3181_2989,,21,,NADH oxidoreductase Hcr,hcr,,Nitrosative stress,,Dispensable,Flavodoxin reductases (ferredoxin-NADPH reductases) family 1,Anaerobic respiratory reductases,,,,FAD; NADH,2Fe-2S,,,,no Sden,1,cyt,Shw01115W3181_2990,,21,,hydroxylamine reductase Hcp,hcp,,Nitrosative stress,,Dispensable,Hydroxylamine reductase (EC 1.7.-.-),Nitrosative stress,,,,,4Fe-4S Fe,,,1.7.99.1,no Sden,1,cyt,Shw01114W3181_2991,,22,,bifunctional chorismate mutase T/prephenate dehydrogenase TyrA,tyrA,,Phenylalanine and Tyrosine Branches from Chorismate,,Dispensable,Chorismate mutase I (EC 5.4.99.5) / Cyclohexadienyl dehydrogenase (EC 1.3.1.12)(EC 1.3.1.43),Chorismate Synthesis; <br>Chorismate Synthesis; <br>Phenylalanine and Tyrosine Branches from Chorismate,,,,,,,,"5.4.99.5, 1.3.1.12",core,1,cyt,Shw01113W3181_2992,,22,,phospho-2-dehydro-3-deoxyheptonate aldolase tyr-sensitive AroF,aroF,,Common Pathway For Synthesis of Aromatic Compounds (DAHP synthase to chorismate),,Dispensable,2-keto-3-deoxy-D-arabino-heptulosonate-7-phosphate synthase I alpha (EC 2.5.1.54),Chorismate Synthesis; <br>Common Pathway For Synthesis of Aromatic Compounds (DAHP synthase to chorismate),,,,,Cd,,,2.5.1.54,core,1,cyt,Shw01112W3181_2993,,22,,50S ribosomal protein L19 RplS,rplS,,Ribosome biogenesis - LSU,,Expected Essential,LSU ribosomal protein L19p,Ribosome LSU bacterial,,,,,,,,,core,1,cyt,Shw01111W3181_2994,,22,,tRNA (guanine-N1)-methyltransferase TrmD,trmD,,tRNA modification,,Expected Essential,tRNA (Guanine37-N1) -methyltransferase (EC 2.1.1.31),Ribosome biogenesis bacterial,,,,,,,,2.1.1.31,core,1,cyt,Shw01110W3181_2995,,22,,16S rRNA processing protein RimM,rimM,,Ribosome biogenenesis - SSU,,Expected Essential,16S rRNA processing protein RimM,Ribosome biogenesis bacterial,,,,,,,,,core,1,cyt,Shw01109W3181_2996,,22,,30S ribosomal protein S16 RpsP,rpsP,,Ribosome SSU,,Expected Essential,SSU ribosomal protein S16p,Ribosome SSU bacterial,,,,,,,,,core,1,cyt,Shw01108W3181_2997,,22,,signal recognition particle protein Ffh,ffh,srp54,protein export - GSP,,Expected Essential,Signal recognition particle subunit Ffh SRP54 (TC 3.A.5.1.1),Two cell division clusters relating to chromosome partitioning; <br>Universal GTPases,,,,GTP,,,3.A.5.1,3.6.5.4,core,1,cyt-IM assoc,Shw01107W3181_2998,,22,,cytochrome c assembly family protein,,,Transport - heme,,Dispensable,FIG001154: CcsA-related protein,,,,,,,,,,core,1,IM 8 TM,Shw01106W3181_2999,,22,,putative transporter HlyC/CorC (HCC) family,,,Transport - HlyC/CorC (HCC) Family,,Dispensable,Hemolysins and related proteins containing CBS domains,,,,,,,,9.A.40,,core,1,IM 4 TM,Shw01105W3181_3000,,22,,inner membrane protein of unknown function DUF962,,,,,Dispensable,hypothetical protein,,,,,,,,,,core,1,IM 4 TM,Shw01104W3181_3001,,22,,holo-(acyl-carrier protein) synthase AcpS,acpS,,Fatty Acid Biosynthesis FASII,,Surprise Dispensable,Holo-[acyl-carrier protein] synthase (EC 2.7.8.7),CBSS-176299.4.peg.1292; <br>Fatty Acid Biosynthesis FASII,,,,,,,,2.7.8.7,core,1,cyt,Shw01103W3181_3002,,22,,pyridoxal phosphate synthase PdxJ,pdxJ,,Cofactor synth: Pyridoxin (vitamin B6),,Expected Essential,Pyridoxine 5-prime-phosphate synthase (EC 2.6.99.2),Pyridoxin (Vitamin B6) Biosynthesis,,,,,,,,2.6.99.2,core,1,cyt,Shw01102W3181_3003,,22,,DNA repair protein RecO,recO,,DNA repair,,Dispensable,DNA recombination and repair protein RecO,CBSS-176299.4.peg.1292; <br>DNA repair bacterial RecFOR pathway,,,,,,,,,core,1,cyt,Shw01101W3181_3004,,22,,30S ribosome assembly GTPase Era,era,,Ribosome biogenesis - SSU,,Expected Essential,GTP-binding protein Era,Bacterial Cell Division; <br>CBSS-176299.4.peg.1292; <br>COG1399; <br>Universal GTPases,,,,GTP,,,,3.6.5.-,core,1,cyt-IM assoc,Shw01100W3181_3005,,22,,ribonuclease III Rnc,rnc,,RNA processing and degradation,,Expected Essential,Ribonuclease III (EC 3.1.26.3),CBSS-176299.4.peg.1292; <br>COG1399; <br>RNA processing and degradation bacterial; <br>Two cell division clusters relating to chromosome partitioning,,,,,,,,3.1.26.3,core,1,cyt,Shw01099W3181_3006,,22,,signal peptidase I LepB,lepB,,protein export,,Expected Essential,Signal peptidase I (EC 3.4.21.89),CBSS-176299.4.peg.1292; <br>Signal peptidase,,,S26A,,,,,3.4.21.89,core,1,IM 1 TM,Shw01098aW3181_3007,,22,,elongation factor 4 LepA,lepA,,Translation elongation factors,,Dispensable,Translation elongation factor LepA,Heat shock dnaK gene cluster extended; <br>Translation elongation factors bacterial; <br>Universal GTPases,,,,GTP,,,,3.6.5.-,core,1,cyt-IM assoc,Shw01097W3181_3008,,22,,sigma E factor positive regulatory protein RseC,rseC,,RseA cell envelope quality control pathway,,Unknown,Sigma factor RpoE regulatory protein RseC,Transcription initiation bacterial sigma factors,,,,,,,,,core,1,IM 2 TM,Shw01096W3181_3009,,22,,sigma E factor regulatory protein RseB,rseB,,RseA cell envelope quality control pathway,,Dispensable,Sigma factor RpoE negative regulatory protein RseB precursor,Periplasmic Stress Response; <br>Transcription initiation bacterial sigma factors,,,,,,,,,core,1,peri-IM assoc,Shw01095W3181_3010,,22,,sigma-E factor negative regulatory protein RseA,rseA,,RseA cell envelope quality control pathway,,Unknown,Sigma factor RpoE negative regulatory protein RseA,Periplasmic Stress Response; <br>Transcription initiation bacterial sigma factors,,,,,,,,,core,1,IM 1 TM,Shw01094W3181_3011,,22,,RNA polymerase sigma factor 24 RpoE,rpoE,,RseA cell envelope quality control pathway,,Unknown,RNA polymerase sigma factor RpoE,Transcription initiation bacterial sigma factors,,,,,,,,,core,1,cyt,Shw01093W3181_3012,,22,,L-aspartate oxidase component of quinolinate synthetase NadB,nadB,,Cofactor synth - NAD de novo synthesis (upstream),,Dispensable,L-aspartate oxidase (EC 1.4.3.16),NAD and NADP cofactor biosynthesis global,,,,FAD,,,,1.4.3.16,core,1,cyt,Shw01092W3181_3013,,22,,protein of unknown function DUF1434,,,,,Unknown,hypothetical protein,,,,,,,,,,core,1,IM 2 TM,Shw01091W3181_3014,,22,,protein of unknown function DUF339,,,,,Expected Essential,YgfY COG2938,,,,,,,,,,core,1,cyt,Shw01090W3181_3015,,22,,transcriptional activator of osmotic stress protection NhaR,nhaR,,Osmoprotection,,Dispensable,Transcriptional activator NhaR,,,LysR,,,,,,,core,1,cyt,Shw01089W3181_3016,,22,,conserved periplasmic protein,,,,,Unknown,hypothetical protein,,,,,,,,,,core,1,peri,Shw01088W3181_3017,,22,,Na+/H+ antiporter NhaA,nhaA,,Transport,,Dispensable,Na+/H+ antiporter NhaA type,Na(+) H(+) antiporter,,,,,,,2.A.33.1,,core,1,IM 11 TM,Shw01087W3181_3018,,22,,thymidylate synthase ThyA,thyA,,Cofactor folate synth,,Expected Essential,Thymidylate synthase (EC 2.1.1.45),Folate Biosynthesis; <br>pyrimidine conversions,,,,,,,,2.1.1.45,core,1,cyt,Shw01086W3181_3019,,12,,prolipoprotein diacylglyceryl transferase Lgt,lgt,,Lipoprotein Biosynthesis,,Expected Essential,Prolipoprotein diacylglyceryl transferase (EC 2.4.99.-),Lipoprotein Biosynthesis,,,,,,,,2.4.99.-,,1,IM 7 TM,Shw01085W3181_3020,,22,,4-toluene sulfonate uptake permease family protein,,,Transport - sulfur,,Dispensable,Protein of unknown function DUF81,ZZ gjo need homes,,,,,,,2.A.102,,core,1,IM 8 TM,Shw01084W3181_3021,,22,,phosphotransferase system (PTS) enzyme I PtsP,ptsP,,PTS system,,Dispensable,FIG001592: Phosphocarrier protein kinase/phosphorylase nitrogen regulation associated,CBSS-364106.7.peg.3204,,,,,,,8.A.7,2.7.3.9,core,1,cyt-IM assoc,Shw01083W3181_3022,,22,,RNA pyrophosphohydrolase RppH,rppH,,,,Unknown,Adenosine (5-prime)-pentaphospho-(5-prime-prime)-adenosine pyrophosphohydrolase (EC 3.6.1.-),CBSS-364106.7.peg.3204; <br>Nudix proteins (nucleoside triphosphate hydrolases),,,,,,,,3.6.1.-,core,1,cyt,Shw01082W3181_3023,,22,,DNA mismatch repair endonuclease MutH,mutH,,DNA repair,,Dispensable,DNA mismatch repair endonuclease MutH,DNA repair bacterial,,,,,,,,,core,1,cyt,Shw01081W3181_3024,,22,,adenylate cyclase CyaC,cyaC,,cAMP signaling,Fnr,Dispensable,Adenylate cyclase (EC 4.6.1.1),cAMP signaling in bacteria,,,,,,,,4.6.1.1,core,1,IM 4 TM,Shw01080W3181_3025,,22,,transcriptional regulator of oxidative stress OxyR,oxyR,,Oxidative stress,,Dispensable,transcriptional regulator LysR family,,,LysR,,,,,,,core,1,cyt,Shw01079W3181_3026,,22,,histidine-containing phosphotransfer domain protein HptA,hptA,,2CP other,,Unknown,Aerobic respiration control sensor protein arcB (EC 2.7.3.-),,,,,,,,,,core,1,cyt,Shw01078W3181_3027,,21,,radical SAM superfamily protein YhcC,yhcC,,,,Dispensable,COG1242: Predicted Fe-S oxidoreductase,,,,,,4Fe-4S,,,,no Sden,1,cyt,Shw01077W3181_3028,,22,,NADPH-dependent glutamate synthase large subunit GltB,gltB,,Ammonia assimilation,ArgR,Dispensable,Glutamate synthase [NADPH] large chain (EC 1.4.1.13),Ammonia assimilation; <br>Glutamine Glutamate Aspartate and Asparagine Biosynthesis,,,C44,NADPH,,,,1.4.1.13,core,1,cyt,Shw01076W3181_3029,,22,,NADPH-dependent glutamate synthase small subunit GltD,gltD,,Ammonia assimilation,ArgR,Dispensable,Glutamate synthase [NADPH] small chain (EC 1.4.1.13),Ammonia assimilation; <br>Glutamine Glutamate Aspartate and Asparagine Biosynthesis,,,,NADPH,,,,1.4.1.13,core,1,cyt,Shw01075W3181_3030,,22,,5-methylthioadenosine nucleosidase/S-adenosylhomocysteine nucleosidase MtnN,mtnN,,Methionine recycling,,Expected Essential,5-prime-methylthioadenosine nucleosidase (EC 3.2.2.16) / S-adenosylhomocysteine nucleosidase (EC 3.2.2.9),Methionine Biosynthesis; <br>Methionine Degradation; <br>Polyamine Metabolism,,,,,,,,"3.2.2.16, 3.2.2.9",core,1,cyt,Shw01074W3181_3031,,22,,adenosylcobinamide-phosphate synthase CobD,cobD,,Cofactor synth - cobalamin,,Dispensable,Adenosylcobinamide-phosphate synthase,Cobalamin synthesis; <br>Coenzyme B12 biosynthesis,,,,,,,,6.3.1.10,core,1,IM 6 TM,Shw01073W3181_3032,,22,,membrane protein of unknown function DUF2721,,,,,Dispensable,hypothetical protein,,,,,,,,,,core,1,IM 3 TM,Shw01072W3181_3033,,22,,homotrimeric cation channel (TRIC) family protein YadS,yadS,,,,Dispensable,Putative inner membrane protein,,,,,,,,1.A.62.2,,core,1,IM 7 TM,Shw01071W3181_3034,,22,,NTF2-like superfamily protein,,,,,Dispensable,hypothetical protein,,,,,,,,,,core,1,peri,Shw01070W3181_3035,,14,,hypothetical periplasmic protein,,,,,Unknown,hypothetical protein,,,,,,,,,,,1,peri,Shw01069W3181_3036,,22,,tyrosyl-tRNA synthetase TyrS,tyrS,,tRNA charging,,Expected Essential,Tyrosyl-tRNA synthetase (EC 6.1.1.1) ## cluster 1,tRNA aminoacylation Tyr,,,,ATP,,,,6.1.1.1,core,1,cyt,Shw01068W3181_3037,,22,,family M23 zinc metallopeptidase with OapA domain,,,peptidase,,Dispensable,Peptidase M23/M37 family,,,,M23B,,,,,,core,1,IM 1 TM,Shw01067W3181_3038,,22,,anhydro-N-acetylmuramic acid kinase AnmK,anmK,,Recycling of Peptidoglycan Amino Acids,,Dispensable,Anhydro-N-acetylmuramic acid kinase (EC 2.7.1.-),Recycling of Peptidoglycan Amino Sugars,,,,,,,,,core,1,cyt,Shw01066W3181_3039,,22,,protein of unknown function DUF2750,,,,,Unknown,hypothetical protein,,,,,,,,,,core,1,cyt,Shw01060W3181_3040,,22,,membrane protein,,,,,Dispensable,hypothetical protein,,,,,,,,,,core,1,IM 3 TM,Shw01059W3181_3041,,22,,iron-sulfur cluster assembly insertion protein ErpA,erpA,,Cofactor synth - FeS,,Expected Essential,probable iron binding protein from the HesB_IscA_SufA family,Fe-S cluster assembly,,,,,,,,,core,1,cyt,Shw01058W3181_3042,,22,,conserved protein of unknown function,,,,,Dispensable,hypothetical protein,,,,,,,,,,core,1,IM 1 TM,Shw01057W3181_3043,,22,,chloride channel protein ClC family,,,Transport - chloride,,Dispensable,Chloride channel protein EriC,,,,M50,,,,2.A.49,,core,1,IM 11 TM,Shw01056W3181_3044,,22,,aspartate carbamoyltransferase PyrB,pyrB,,De Novo Pyrimidine Synthesis,,Dispensable,Aspartate carbamoyltransferase (EC 2.1.3.2),CBSS-320372.3.peg.6046; <br>De Novo Pyrimidine Synthesis,,,,,,,,2.1.3.2,core,1,cyt,Shw01055W3181_3045,,22,,glutamate-1-semialdehyde-21-aminomutase HemL,hemL,,Cofactor synth - heme siroheme,,Expected Essential,Glutamate-1-semialdehyde aminotransferase (EC 5.4.3.8),CBSS-196164.1.peg.461; <br>CPO analysis; <br>Experimental tye; <br>Heme and Siroheme Biosynthesis,,,,pyridoxyl phosphate (PLP),,,,5.4.3.8,core,1,cyt,Shw01054W3181_3046,,21,,Na+:H+ antiporter NhaD family,,,Transport|antiport,,,Na+/H+ antiporter NhaD,,,,,,,,2.A.62,,no Spea,1,IM 10 TM,Shw01053aW3181_3047,,22,,T2aSS secretion system protein B GspB,gspB,,T2aSS,,Dispensable,General secretion pathway protein B,General Secretion Pathway,,,,,,,9.B.42.1,,core,1,IM 1 TM,Shw01052W3181_3048,,22,,T2aSS secretion system protein A GspA,gspA,,T2aSS,,Dispensable,General secretion pathway protein A,General Secretion Pathway,,,,ATP,,peptidoglycan,9.B.42.1,,core,1,IM 1 TM,Shw01051W3181_3049,,22,,tRNA nucleotidyltransferase Cca,cca,,,,,tRNA nucleotidyltransferase (EC 2.7.7.21) (EC 2.7.7.25),Polyadenylation bacterial; <br>tRNA nucleotidyltransferase,,,,,,,,2.7.7.25,core,1,cyt,Shw01050W3181_3050,,22,,murein lipoprotein Lpp,lpp,,,,Dispensable,major outer membrane lipoprotein putative,,,,,,,,,,core,1,LP-OM pep anchored,Shw01049W3181_3051,,22,,ribosomal RNA large subunit methyltransferase A,,,,,Unknown,Ribosomal RNA large subunit methyltransferase A,,,,,,,,,2.1.1.187,core,1,cyt,Shw01048W3181_3052,,22,,undecaprenol diphosphatase UppP,uppP,,,,Dispensable,Undecaprenyl-diphosphatase (EC 3.6.1.27),,,,,,,,,3.6.1.27,core,1,IM 8 TM,Shw01047W3181_3053,,22,,2-amino-4-hydroxy-6-hydroxymethyldihydropteridine pyrophosphokinase FolK-like,,,Folate Biosynthesis,,Dispensable,2-amino-4-hydroxy-6-hydroxymethyldihydropteridine pyrophosphokinase (EC 2.7.6.3),Folate Biosynthesis,,,,,,,,2.7.6.3,core,1,cyt,Shw01046W3181_3054,,22,,dihydroneopterin aldolase FolB,folB,,Folate Biosynthesis,,Expected Essential,Dihydroneopterin aldolase (EC 4.1.2.25),Folate Biosynthesis,,,,,,,,4.1.2.25,core,1,cyt,Shw01045W3181_3055,,22,,acyl-PO4 glycerol-3-phosphate acyltransferase PlsY,plyY,ygiH,Glycerolipid and Glycerophospholipid Metabolism,,Dispensable,Acyl-phosphate:glycerol-3-phosphate O-acyltransferase PlsY,Glycerolipid and Glycerophospholipid Metabolism in Bacteria,,,,,,,9.B.31.1,2.3.1.-,core,1,IM 4 TM,Shw01044W3181_3056,,22,,essential endopeptidase YgiD,ygiD,,YjeE/YeaZ/YgjD essential signal transduction network induced in urine,,Expected Essential,YgjD/Kae1/Qri7 family required for threonylcarbamoyladenosine (t(6)A) formation in tRNA,Bacterial RNA-metabolizing Zn-dependent hydrolases; <br>Conserved gene cluster associated with Met-tRNA formyltransferase; <br>Macromolecular synthesis operon; <br>YgjD and YeaZ,,,M22,,,,,3.4.24.57,core,1,cyt,Shw01043W3181_3057,,22,,30S ribosomal protein S21 RpsU,rpsU,,Ribosome SSU,,Unknown,SSU ribosomal protein S21p,Macromolecular synthesis operon; <br>Ribosome SSU bacterial,,,,,,,,,core,1,cyt,Shw01042W3181_3058,,22,,transamidase with YqeY domain,,,,,Unknown,Transamidase GatB domain protein,Macromolecular synthesis operon,,,,,,,,,core,1,cyt,Shw01041W3181_3059,,22,,DNA primase DnaG,dnaG,,DNA-replication,,Expected Essential,DNA primase (EC 2.7.7.-),DNA-replication; <br>Macromolecular synthesis operon,,,,,,,,2.7.7.-,core,1,cyt,Shw01040W3181_3060,,22,,RNA polymerase sigma-70 factor RpoD,rpoD,,Transcription initiation bacterial sigma factors,,Expected Essential,RNA polymerase sigma factor RpoD,Flagellum; <br>Macromolecular synthesis operon; <br>Transcription initiation bacterial sigma factors,,,,,,,,,core,1,cyt,Shw01039W3181_3061,,16,,chemotaxis signal transduction system methyl accepting sensory transducer,,,Chemotaxis,,Dispensable,Methyl-accepting chemotaxis protein,,,,,,,,,,,1,IM 2 TM,Shw01038W3181_3062,,12,,proton:oligopeptide symporter POT family,,,Transport|symport - H:peptide,,Dispensable,Di/tripeptide permease DtpA,Proton-dependent Peptide Transporters,,,,,,,2.A.17.1,,,1,IM 14 TM,Shw01037W3181_3063,,11,,luciferase family protein,,,,,,Bacterial luciferase family protein,,,,,,,,,,,1,cyt,Shw06660W3181_3064,,20,,GABA aminotransferase PLP-dependent PuuE,puuE,,Putrescine utilization,,Dispensable,Gamma-aminobutyrate:alpha-ketoglutarate aminotransferase (EC 2.6.1.19),Putrescine utilization pathways,,,,pyridoxyl phosphate (PLP),,,,2.6.1.19,core? (check Sben),1,cyt,Shw01036W3181_3065,,22,,gamma-glutamyl-gamma-aminobutyraldehyde dehydrogenase PuuC,puuC,,putrescine utilization,,Dispensable,Succinate-semialdehyde dehydrogenase [NADP+] (EC 1.2.1.16),,,,,,,,,1.2.1.19,core,1,cyt,Shw01035W3181_3066,,21,,gamma-glutamylputrescine oxidoreductase PuuB,puuB,,Putrescine utilization,,Dispensable,Gamma-glutamyl-putrescine oxidase (EC1.4.3.-),Putrescine utilization pathways,,,,FAD,,,,1.4.3.-,no SVI,1,cyt,Shw01034W3181_3067,,21,22125499,ABC-type putrescine uptake system permease component 2 PotI,potI,,Transport | uptake ABC - putrescine leucine alanine methionie D-lactate,ArgR,Dispensable,Putrescine transport system permease protein PotI (TC 3.A.1.11.2),Polyamine Metabolism,,,,,,,3.A.1.11,,no SVI,1,IM 7 TM,Shw01033W3181_3068,,21,22125499,ABC-type putrescine uptake system permease component 1 PotH,potH,,Transport | uptake ABC - putrescine leucine alanine methionie D-lactate,ArgR,Dispensable,Putrescine transport system permease protein PotH (TC 3.A.1.11.2),Polyamine Metabolism,,,,,,,3.A.1.11,,no SVI,1,IM 6 TM,Shw01032W3181_3069,,21,22125499,ABC-type putrescine uptake system ATPase component PotG,potG,,Transport | uptake ABC - putrescine leucine alanine methionie D-lactate,ArgR,Dispensable,Putrescine transport ATP-binding protein PotG (TC 3.A.1.11.2),Polyamine Metabolism,,,,ATP,,,3.A.1.11,3.6.3.31,no SVI,1,cyt-IM assoc,Shw01031W3181_3070,,21,22125499,ABC-type putrescine uptake system substrate-binding component PotF,potF,,Transport | uptake ABC - putrescine leucine alanine methionie D-lactate,ArgR,Dispensable,Putrescine ABC transporter putrescine-binding protein PotF (TC 3.A.1.11.2),Polyamine Metabolism,,,,,,,3.A.1.11,,no SVI,1,peri,Shw01030W3181_3071,,21,22125499,gamma-glutamyl-putrescine synthase PuuA,puuA,,Putrescine utilization,,Dispensable,Gamma-glutamyl-putrescine synthetase (EC 6.3.1.11),Putrescine utilization pathways,,,,ATP,,,,6.3.1.11,no SVI,1,cyt,Shw01029W3181_3072,,21,22125499,gamma-glutamyl-aminobutyrate hydrolase PuuD,puuD,,Putrescine utilization,,Dispensable,Gamma-glutamyl-GABA hydrolase (EC 3.5.1.94),Putrescine utilization pathways,,,C26,,,,,3.5.1.94,no SVI,1,cyt,Shw01028W3181_3073,,20,,transcriptional regulator of putrescine degradation PuuR,puuR,,1CP - Putrescine utilization,,Unknown,Putrescine utilization regulator,Putrescine utilization pathways,,HTH_3,,,,,,,mtr core,1,cyt,Shw01027W3181_3074,,19,,FAD-dependent oxidoreductase,,,Putrescine utilization,,Dispensable,Gamma-glutamyl-putrescine oxidase (EC1.4.3.-),Putrescine utilization pathways,,,,FAD,,,,,mtr core? (check Sben),1,cyt,Shw01026W3181_3075,,12,,protein of unknown function DUF2937,,,,,Dispensable,hypothetical protein,,,,,,,,,,,1,IM 1 TM,Shw01025W3181_3076,,15,,mercaptopyruvate sulfurtransferase SseA,sseA,,Cysteine degradation,,Dispensable,3-mercaptopyruvate sulfurtransferase (EC 2.8.1.2),,,,,,,,,2.8.1.2,,1,cyt,Shw01024W3181_3077,,11,,rplA family lipoprotein,,,,,,Lipoprotein A family protein,,,,,,,,,,,1,LP-OM,Shw06655W3181_3078,,1,,hypothetical protein,,,,,,Putative acetyltransferase,,,,,,,,,,mobile - integron,1,cyt,W3181_3078W3181_3078.1 W3181_4133,,1,,hypothetical protein,,,,,,,,,,,,,,,,mobile - integron,1,IM 4 TM,W3181_3078.1W3181_3079,,20,22125499,succinate-semialdehyde dehydrogenase [NAD(P)+] GabD,gabD,,Putrescine utilization,,Dispensable,Gamma-glutamyl-aminobutyraldehyde dehydrogenase (EC 1.2.1.-),Putrescine utilization pathways,,,,NADP,,,,"1.2.1.16, 1.2.1.19",no SVI (check Sben),1,cyt,Shw07196W3181_3080,,19,,beta-alanine-pyruvate transaminase AptA,aptA,,Pyruvate Alanine Serine Interconversions,,Dispensable,Omega-amino acid--pyruvate aminotransferase (EC 2.6.1.18),Pyruvate Alanine Serine Interconversions,,,,pyridoxyl phsophate (PLP),,,,2.6.1.18,no Sden Svi (check Sben),1,cyt,Shw07104W3181_3081,,19,,aldehyde dehydrogenase oxidoreductase,,,Valine degradation,,,Methylmalonate-semialdehyde dehydrogenase (EC 1.2.1.27),Valine degradation,,,,,,,,1.2.1.-,no Sden Svi (check Sben),1,cyt,Shw07103